### ISSUE TITLE
client read or write is hangs

### ISSUE THREAD

**Issue by Hughen** [nfs-ganesha/nfs-ganesha#452]
My nfs client can not read/write to nfs server, it will be always hanged, and nothing happens here.
ubuntu client package version: `1.2.8-6ubuntu1.2`, ip: `10.10.249.1`
NFS Server version: `V2.7.3`, ip: `10.10.249.233`

mount command:
```bash
sudo mount -t nfs -o port=2049,vers=4.2 10.10.249.233:/efs /mnt/test --verbose
```

When I write anything to `/mnt/test/1.txt`, the write process will be hanged, as follow:
```bash
sudo dd if=/dev/zero of=/mnt/test/1.txt oflag=direct bs=1M count=6144
```

`/etc/ganesha/ganesha.conf` content:
```conf
NFS_CORE_PARAM {
        Enable_NLM = false;
        Enable_RQUOTA = false;
        Protocols = 3, 4;
        NFS_Port = 2049;
}

CACHEINODE {
        Dir_Chunk = 0;
        NParts = 1;
        Cache_Size = 1;
}

EXPORT_DEFAULTS {
        Attr_Expiration_Time = 0;
}

EXPORT {
    Export_ID = 100;
    Protocols = 3, 4;
    Path = /;
    Access_Type = RW;

    FSAL {
        Name = CEPH;
    }
}

CEPH {
    ceph_conf = '/etc/ceph/ceph.conf';
}

LOG {
    COMPONENTS {
        DISPATCH = FULL_DEBUG;
    }
}

NFSv4 {
        Delegations = false;
        RecoveryBackend = 'rados_cluster';
        Minor_Versions = 1, 2;
}

RADOS_KV {
        ceph_conf = '/etc/ceph/ceph.conf';
        userid = admin;
        nodeid = mynfs.a;
        pool = "nfs-ganesha";
        namespace = "nfs-ns";
}

RADOS_URLS {
        ceph_conf = '/etc/ceph/ceph.conf';
        userid = admin;
        watch_url = 'rados://nfs-ganesha/nfs-ns/conf-mynfs.a';
}

%url    rados://nfs-ganesha/nfs-ns/conf-mynfs.a
```
The process `ganesha.nfsd` log is:
```log
31/07/2019 07:29:21 : epoch 5d414351 : s04 : nfs-ganesha-1137[main] main :MAIN :EVENT :nfs-ganesha Starting: Ganesha Version 2.7.3                                                                                
31/07/2019 07:29:21 : epoch 5d414351 : s04 : nfs-ganesha-1137[main] log_conf_commit :CONFIG :EVENT :Switching to new component log levels                                                                         
31/07/2019 07:29:21 : epoch 5d414351 : s04 : nfs-ganesha-1137[main] nfs_set_param_from_conf :NFS STARTUP :EVENT :Configuration file successfully parsed                                                           
31/07/2019 07:29:21 : epoch 5d414351 : s04 : nfs-ganesha-1137[main] init_server_pkgs :NFS STARTUP :EVENT :Initializing ID Mapper.                                                                                 
31/07/2019 07:29:21 : epoch 5d414351 : s04 : nfs-ganesha-1137[main] init_server_pkgs :NFS STARTUP :EVENT :ID Mapper successfully initialized.                                                                     
31/07/2019 07:29:21 : epoch 5d414351 : s04 : nfs-ganesha-1137[main] nfs_start_grace :STATE :EVENT :NFS Server Now IN GRACE, duration 90                                                                           
31/07/2019 07:29:21 : epoch 5d414351 : s04 : nfs-ganesha-1137[main] rados_cluster_grace_enforcing :CLIENT ID :EVENT :rados_cluster_grace_enforcing: ret=-45                                                       
31/07/2019 07:29:23 : epoch 5d414351 : s04 : nfs-ganesha-1137[main] nfs_start_grace :STATE :EVENT :NFS Server Now IN GRACE, duration 90                                                                           
31/07/2019 07:29:23 : epoch 5d414351 : s04 : nfs-ganesha-1137[main] rados_cluster_grace_enforcing :CLIENT ID :EVENT :rados_cluster_grace_enforcing: ret=0                                                         
31/07/2019 07:29:23 : epoch 5d414351 : s04 : nfs-ganesha-1137[main] export_commit_common :CONFIG :CRIT :Exporting to NFSv4 but no Pseudo path defined                                                             
31/07/2019 07:29:23 : epoch 5d414351 : s04 : nfs-ganesha-1137[main] reclaim_reset :FSAL :EVENT :start_reclaim failed: -2                                                                                          
31/07/2019 07:29:23 : epoch 5d414351 : s04 : nfs-ganesha-1137[main] config_errs_to_log :CONFIG :CRIT :Config File (/etc/ganesha/ganesha.conf:19): 1 validation errors in block EXPORT                             
31/07/2019 07:29:23 : epoch 5d414351 : s04 : nfs-ganesha-1137[main] config_errs_to_log :CONFIG :CRIT :Config File (/etc/ganesha/ganesha.conf:19): Errors processing block (EXPORT)                                
31/07/2019 07:29:23 : epoch 5d414351 : s04 : nfs-ganesha-1137[main] lower_my_caps :NFS STARTUP :EVENT :CAP_SYS_RESOURCE was successfully removed for proper quota management in FSAL                              
31/07/2019 07:29:23 : epoch 5d414351 : s04 : nfs-ganesha-1137[main] lower_my_caps :NFS STARTUP :EVENT :currenty set capabilities are: = cap_chown,cap_dac_override,cap_fowner,cap_fsetid,cap_kill,cap_setgid,cap_se
tuid,cap_setpcap,cap_net_bind_service,cap_net_raw,cap_sys_chroot,cap_mknod,cap_audit_write,cap_setfcap+eip                                                                                                        
31/07/2019 07:29:23 : epoch 5d414351 : s04 : nfs-ganesha-1137[main] nfs_Init_svc :DISP :DEBUG :NFS INIT: Core options = 3                                                                                         
31/07/2019 07:29:23 : epoch 5d414351 : s04 : nfs-ganesha-1137[main] nfs_Init_svc :DISP :INFO :NFS INIT: using TIRPC                                                                                               
31/07/2019 07:29:23 : epoch 5d414351 : s04 : nfs-ganesha-1137[main] nfs_Init_svc :DISP :F_DBG :netconfig found for UDPv4 and TCPv4                                                                                
31/07/2019 07:29:23 : epoch 5d414351 : s04 : nfs-ganesha-1137[main] nfs_Init_svc :DISP :INFO :NFS INIT: Using IPv6                                                                                                
31/07/2019 07:29:23 : epoch 5d414351 : s04 : nfs-ganesha-1137[main] nfs_Init_svc :DISP :F_DBG :netconfig found for UDPv6 and TCPv6                                                                                
31/07/2019 07:29:23 : epoch 5d414351 : s04 : nfs-ganesha-1137[main] Allocate_sockets :DISP :F_DBG :Allocation of the sockets                                                                                      
31/07/2019 07:29:23 : epoch 5d414351 : s04 : nfs-ganesha-1137[main] Allocate_sockets :DISP :DEBUG :Socket numbers are: NFS tcp=58 udp=57                                                                          
31/07/2019 07:29:23 : epoch 5d414351 : s04 : nfs-ganesha-1137[main] Allocate_sockets :DISP :DEBUG :Socket numbers are: MNT tcp=60 udp=59                                                                          
31/07/2019 07:29:23 : epoch 5d414351 : s04 : nfs-ganesha-1137[main] Bind_sockets :DISP :INFO :Bind sockets successful, v6disabled = 0, vsock = 0, rdma = 0                                                        
31/07/2019 07:29:23 : epoch 5d414351 : s04 : nfs-ganesha-1137[svc_3] nfs_rpc_decode_request :DISP :DEBUG :0x6225140 fd 61 context 0x7fb1a0000c90                                                                  
31/07/2019 07:29:23 : epoch 5d414351 : s04 : nfs-ganesha-1137[svc_3] nfs_rpc_decode_request :DISP :DEBUG :SVC_DECODE on 0x6225140 fd 61 (::1:111) xid=1 returned XPRT_IDLE                                        
31/07/2019 07:29:23 : epoch 5d414351 : s04 : nfs-ganesha-1137[svc_3] free_nfs_request :DISP :DEBUG :free_nfs_request: 0x6225140 fd 61 xp_refcnt 3 rq_refcnt 0                                                     
31/07/2019 07:29:23 : epoch 5d414351 : s04 : nfs-ganesha-1137[svc_5] nfs_rpc_decode_request :DISP :DEBUG :0x6225550 fd 65 context 0x7fb198000c90                                                                  
31/07/2019 07:29:23 : epoch 5d414351 : s04 : nfs-ganesha-1137[svc_5] nfs_rpc_decode_request :DISP :DEBUG :SVC_DECODE on 0x6225550 fd 65 (::1:111) xid=1 returned XPRT_IDLE                                        
31/07/2019 07:29:23 : epoch 5d414351 : s04 : nfs-ganesha-1137[svc_5] free_nfs_request :DISP :DEBUG :free_nfs_request: 0x6225550 fd 65 xp_refcnt 3 rq_refcnt 0                                                     
31/07/2019 07:29:23 : epoch 5d414351 : s04 : nfs-ganesha-1137[svc_3] nfs_rpc_decode_request :DISP :DEBUG :0x6225960 fd 66 context 0x7fb1a0001060                                                                  
31/07/2019 07:29:23 : epoch 5d414351 : s04 : nfs-ganesha-1137[svc_3] nfs_rpc_decode_request :DISP :DEBUG :SVC_DECODE on 0x6225960 fd 66 (::1:111) xid=1 returned XPRT_IDLE                                        
31/07/2019 07:29:23 : epoch 5d414351 : s04 : nfs-ganesha-1137[svc_3] free_nfs_request :DISP :DEBUG :free_nfs_request: 0x6225960 fd 66 xp_refcnt 3 rq_refcnt 0                                                     
31/07/2019 07:29:23 : epoch 5d414351 : s04 : nfs-ganesha-1137[svc_7] nfs_rpc_decode_request :DISP :DEBUG :0x6225d70 fd 67 context 0x7fb190000c90                                                                  
31/07/2019 07:29:23 : epoch 5d414351 : s04 : nfs-ganesha-1137[svc_7] nfs_rpc_decode_request :DISP :DEBUG :SVC_DECODE on 0x6225d70 fd 67 (::1:111) xid=1 returned XPRT_IDLE                                        
31/07/2019 07:29:23 : epoch 5d414351 : s04 : nfs-ganesha-1137[svc_7] free_nfs_request :DISP :DEBUG :free_nfs_request: 0x6225d70 fd 67 xp_refcnt 3 rq_refcnt 0                                                     
31/07/2019 07:29:23 : epoch 5d414351 : s04 : nfs-ganesha-1137[svc_5] nfs_rpc_decode_request :DISP :DEBUG :0x6226180 fd 68 context 0x7fb198000c90                                                                  
31/07/2019 07:29:23 : epoch 5d414351 : s04 : nfs-ganesha-1137[svc_5] nfs_rpc_decode_request :DISP :DEBUG :SVC_DECODE on 0x6226180 fd 68 (::1:111) xid=1 returned XPRT_IDLE                                        
31/07/2019 07:29:23 : epoch 5d414351 : s04 : nfs-ganesha-1137[svc_5] free_nfs_request :DISP :DEBUG :free_nfs_request: 0x6226180 fd 68 xp_refcnt 3 rq_refcnt 0                                                     
31/07/2019 07:29:23 : epoch 5d414351 : s04 : nfs-ganesha-1137[svc_9] nfs_rpc_decode_request :DISP :DEBUG :0x6226590 fd 69 context 0x7fb1840008c0                                                                  
31/07/2019 07:29:23 : epoch 5d414351 : s04 : nfs-ganesha-1137[svc_9] nfs_rpc_decode_request :DISP :DEBUG :SVC_DECODE on 0x6226590 fd 69 (::1:111) xid=1 returned XPRT_IDLE                                        
31/07/2019 07:29:23 : epoch 5d414351 : s04 : nfs-ganesha-1137[svc_9] free_nfs_request :DISP :DEBUG :free_nfs_request: 0x6226590 fd 69 xp_refcnt 3 rq_refcnt 0                                                     
31/07/2019 07:29:23 : epoch 5d414351 : s04 : nfs-ganesha-1137[svc_3] nfs_rpc_decode_request :DISP :DEBUG :0x62269a0 fd 70 context 0x7fb1a0001060                                                                  
31/07/2019 07:29:23 : epoch 5d414351 : s04 : nfs-ganesha-1137[svc_3] nfs_rpc_decode_request :DISP :DEBUG :SVC_DECODE on 0x62269a0 fd 70 (::1:111) xid=1 returned XPRT_IDLE                                        
31/07/2019 07:29:23 : epoch 5d414351 : s04 : nfs-ganesha-1137[svc_3] free_nfs_request :DISP :DEBUG :free_nfs_request: 0x62269a0 fd 70 xp_refcnt 3 rq_refcnt 0                                                     
31/07/2019 07:29:23 : epoch 5d414351 : s04 : nfs-ganesha-1137[svc_11] nfs_rpc_decode_request :DISP :DEBUG :0x6226dd0 fd 71 context 0x7fb1880008c0                                                                 
31/07/2019 07:29:23 : epoch 5d414351 : s04 : nfs-ganesha-1137[svc_11] nfs_rpc_decode_request :DISP :DEBUG :SVC_DECODE on 0x6226dd0 fd 71 (::1:111) xid=1 returned XPRT_IDLE                                       
31/07/2019 07:29:23 : epoch 5d414351 : s04 : nfs-ganesha-1137[svc_11] free_nfs_request :DISP :DEBUG :free_nfs_request: 0x6226dd0 fd 71 xp_refcnt 3 rq_refcnt 0                                                    
31/07/2019 07:29:23 : epoch 5d414351 : s04 : nfs-ganesha-1137[svc_7] nfs_rpc_decode_request :DISP :DEBUG :0x622a700 fd 72 context 0x7fb190000c90                                                                  
31/07/2019 07:29:23 : epoch 5d414351 : s04 : nfs-ganesha-1137[svc_7] nfs_rpc_decode_request :DISP :DEBUG :SVC_DECODE on 0x622a700 fd 72 (::1:111) xid=1 returned XPRT_IDLE
.....
31/07/2019 07:30:57 : epoch 5d414351 : s04 : nfs-ganesha-1137[svc_26] nfs_rpc_process_request :DISP :F_DBG :About to authenticate Prog=100003, vers=4, proc=1, xid=4218342363, SVCXPRT=0x7fb1780008c0, fd=108     
31/07/2019 07:30:57 : epoch 5d414351 : s04 : nfs-ganesha-1137[svc_26] nfs_rpc_process_request :DISP :F_DBG :Before SVCAUTH_CHECKSUM on SVCXPRT 0x7fb1780008c0 fd 108                                              
31/07/2019 07:30:57 : epoch 5d414351 : s04 : nfs-ganesha-1137[svc_26] nfs_rpc_process_request :DISP :DEBUG :Request from ::ffff:10.10.249.16 for Program 100003, Version 4, Function 1 has xid=4218342363         
31/07/2019 07:30:57 : epoch 5d414351 : s04 : nfs-ganesha-1137[svc_26] nfs_rpc_process_request :DISP :F_DBG :Current request is not duplicate or not cacheable.                                                    
31/07/2019 07:30:57 : epoch 5d414351 : s04 : nfs-ganesha-1137[svc_26] nfs_req_creds :DISP :M_DBG :DISP: MID DEBUG: AUTH_SYS creds mapped to uid=999, gid=999, glen=3                                              
31/07/2019 07:30:57 : epoch 5d414351 : s04 : nfs-ganesha-1137[svc_26] nfs_rpc_process_request :DISP :F_DBG :Before svc_sendreply on socket 108                                                                    
31/07/2019 07:30:57 : epoch 5d414351 : s04 : nfs-ganesha-1137[svc_26] nfs_rpc_process_request :DISP :F_DBG :After svc_sendreply on socket 108                                                                     
31/07/2019 07:30:57 : epoch 5d414351 : s04 : nfs-ganesha-1137[svc_26] nfs_rpc_decode_request :DISP :DEBUG :SVC_DECODE on 0x7fb1780008c0 fd 108 (::ffff:10.10.249.16:873) xid=4218342363 returned XPRT_IDLE        
31/07/2019 07:30:57 : epoch 5d414351 : s04 : nfs-ganesha-1137[svc_26] free_nfs_request :DISP :DEBUG :free_nfs_request: 0x7fb1780008c0 fd 108 xp_refcnt 5 rq_refcnt 0                                              
31/07/2019 07:30:58 : epoch 5d414351 : s04 : nfs-ganesha-1137[svc_49] nfs_rpc_decode_request :DISP :DEBUG :0x7fb19c000c90 fd 100 context 0x7fb0bc0008c0                                                           
31/07/2019 07:30:58 : epoch 5d414351 : s04 : nfs-ganesha-1137[svc_49] nfs_rpc_process_request :DISP :F_DBG :About to authenticate Prog=100003, vers=4, proc=1, xid=2507104523, SVCXPRT=0x7fb19c000c90, fd=100     
31/07/2019 07:30:58 : epoch 5d414351 : s04 : nfs-ganesha-1137[svc_49] nfs_rpc_process_request :DISP :F_DBG :Before SVCAUTH_CHECKSUM on SVCXPRT 0x7fb19c000c90 fd 100                                              
31/07/2019 07:30:58 : epoch 5d414351 : s04 : nfs-ganesha-1137[svc_49] nfs_rpc_process_request :DISP :DEBUG :Request from ::ffff:10.10.249.18 for Program 100003, Version 4, Function 1 has xid=2507104523         
31/07/2019 07:30:58 : epoch 5d414351 : s04 : nfs-ganesha-1137[svc_49] nfs_rpc_process_request :DISP :F_DBG :Current request is not duplicate or not cacheable.                                                    
31/07/2019 07:30:58 : epoch 5d414351 : s04 : nfs-ganesha-1137[svc_49] nfs_req_creds :DISP :M_DBG :DISP: MID DEBUG: AUTH_SYS creds mapped to uid=999, gid=999, glen=3                                              
31/07/2019 07:30:58 : epoch 5d414351 : s04 : nfs-ganesha-1137[svc_49] nfs_rpc_process_request :DISP :F_DBG :Before svc_sendreply on socket 100                                                                    
31/07/2019 07:30:58 : epoch 5d414351 : s04 : nfs-ganesha-1137[svc_49] nfs_rpc_process_request :DISP :F_DBG :After svc_sendreply on socket 100                                                                     
31/07/2019 07:30:58 : epoch 5d414351 : s04 : nfs-ganesha-1137[svc_49] nfs_rpc_decode_request :DISP :DEBUG :SVC_DECODE on 0x7fb19c000c90 fd 100 (::ffff:10.10.249.18:840) xid=2507104523 returned XPRT_IDLE        
31/07/2019 07:30:58 : epoch 5d414351 : s04 : nfs-ganesha-1137[svc_49] free_nfs_request :DISP :DEBUG :free_nfs_request: 0x7fb19c000c90 fd 100 xp_refcnt 5 rq_refcnt 0                                              
31/07/2019 07:30:58 : epoch 5d414351 : s04 : nfs-ganesha-1137[svc_29] nfs_rpc_decode_request :DISP :DEBUG :0x7fb1780008c0 fd 108 context 0x7fb10c000ca0                                                           
31/07/2019 07:30:58 : epoch 5d414351 : s04 : nfs-ganesha-1137[svc_29] nfs_rpc_process_request :DISP :F_DBG :About to authenticate Prog=100003, vers=4, proc=1, xid=4235119579, SVCXPRT=0x7fb1780008c0, fd=108     
31/07/2019 07:30:58 : epoch 5d414351 : s04 : nfs-ganesha-1137[svc_29] nfs_rpc_process_request :DISP :F_DBG :Before SVCAUTH_CHECKSUM on SVCXPRT 0x7fb1780008c0 fd 108                                              
31/07/2019 07:30:58 : epoch 5d414351 : s04 : nfs-ganesha-1137[svc_29] nfs_rpc_process_request :DISP :DEBUG :Request from ::ffff:10.10.249.16 for Program 100003, Version 4, Function 1 has xid=4235119579         
31/07/2019 07:30:58 : epoch 5d414351 : s04 : nfs-ganesha-1137[svc_29] nfs_rpc_process_request :DISP :F_DBG :Current request is not duplicate or not cacheable.                                                    
31/07/2019 07:30:58 : epoch 5d414351 : s04 : nfs-ganesha-1137[svc_29] nfs_req_creds :DISP :M_DBG :DISP: MID DEBUG: AUTH_SYS creds mapped to uid=999, gid=999, glen=3                                              
31/07/2019 07:30:58 : epoch 5d414351 : s04 : nfs-ganesha-1137[svc_29] nfs_rpc_process_request :DISP :F_DBG :Before svc_sendreply on socket 108                                                                    
31/07/2019 07:30:58 : epoch 5d414351 : s04 : nfs-ganesha-1137[svc_29] nfs_rpc_process_request :DISP :F_DBG :After svc_sendreply on socket 108                                                                     
31/07/2019 07:30:58 : epoch 5d414351 : s04 : nfs-ganesha-1137[svc_29] nfs_rpc_decode_request :DISP :DEBUG :SVC_DECODE on 0x7fb1780008c0 fd 108 (::ffff:10.10.249.16:873) xid=4235119579 returned XPRT_IDLE        
31/07/2019 07:30:58 : epoch 5d414351 : s04 : nfs-ganesha-1137[svc_29] free_nfs_request :DISP :DEBUG :free_nfs_request: 0x7fb1780008c0 fd 108 xp_refcnt 5 rq_refcnt 0                                              
31/07/2019 07:30:59 : epoch 5d414351 : s04 : nfs-ganesha-1137[svc_50] nfs_rpc_decode_request :DISP :DEBUG :0x7fb19c000c90 fd 100 context 0x7fb0b00008c0                                                           
31/07/2019 07:30:59 : epoch 5d414351 : s04 : nfs-ganesha-1137[svc_50] nfs_rpc_process_request :DISP :F_DBG :About to authenticate Prog=100003, vers=4, proc=1, xid=2523881739, SVCXPRT=0x7fb19c000c90, fd=100     
31/07/2019 07:30:59 : epoch 5d414351 : s04 : nfs-ganesha-1137[svc_50] nfs_rpc_process_request :DISP :F_DBG :Before SVCAUTH_CHECKSUM on SVCXPRT 0x7fb19c000c90 fd 100                                              
31/07/2019 07:30:59 : epoch 5d414351 : s04 : nfs-ganesha-1137[svc_50] nfs_rpc_process_request :DISP :DEBUG :Request from ::ffff:10.10.249.18 for Program 100003, Version 4, Function 1 has xid=2523881739         
31/07/2019 07:30:59 : epoch 5d414351 : s04 : nfs-ganesha-1137[svc_50] nfs_rpc_process_request :DISP :F_DBG :Current request is not duplicate or not cacheable.                                                    
31/07/2019 07:30:59 : epoch 5d414351 : s04 : nfs-ganesha-1137[svc_50] nfs_req_creds :DISP :M_DBG :DISP: MID DEBUG: AUTH_SYS creds mapped to uid=999, gid=999, glen=3                                              
31/07/2019 07:30:59 : epoch 5d414351 : s04 : nfs-ganesha-1137[svc_50] nfs_rpc_process_request :DISP :F_DBG :Before svc_sendreply on socket 100                                                                    
31/07/2019 07:30:59 : epoch 5d414351 : s04 : nfs-ganesha-1137[svc_50] nfs_rpc_process_request :DISP :F_DBG :After svc_sendreply on socket 100                                                                     
31/07/2019 07:30:59 : epoch 5d414351 : s04 : nfs-ganesha-1137[svc_50] nfs_rpc_decode_request :DISP :DEBUG :SVC_DECODE on 0x7fb19c000c90 fd 100 (::ffff:10.10.249.18:840) xid=2523881739 returned XPRT_IDLE        
31/07/2019 07:30:59 : epoch 5d414351 : s04 : nfs-ganesha-1137[svc_50] free_nfs_request :DISP :DEBUG :free_nfs_request: 0x7fb19c000c90 fd 100 xp_refcnt 5 rq_refcnt 0                                              
31/07/2019 07:30:59 : epoch 5d414351 : s04 : nfs-ganesha-1137[svc_51] nfs_rpc_decode_request :DISP :DEBUG :0x7fb1780008c0 fd 108 context 0x7fb0b40008c0                                                           
31/07/2019 07:30:59 : epoch 5d414351 : s04 : nfs-ganesha-1137[svc_51] nfs_rpc_process_request :DISP :F_DBG :About to authenticate Prog=100003, vers=4, proc=1, xid=4251896795, SVCXPRT=0x7fb1780008c0, fd=108     
31/07/2019 07:30:59 : epoch 5d414351 : s04 : nfs-ganesha-1137[svc_51] nfs_rpc_process_request :DISP :F_DBG :Before SVCAUTH_CHECKSUM on SVCXPRT 0x7fb1780008c0 fd 108                                              
31/07/2019 07:30:59 : epoch 5d414351 : s04 : nfs-ganesha-1137[svc_51] nfs_rpc_process_request :DISP :DEBUG :Request from ::ffff:10.10.249.16 for Program 100003, Version 4, Function 1 has xid=4251896795         
31/07/2019 07:30:59 : epoch 5d414351 : s04 : nfs-ganesha-1137[svc_51] nfs_rpc_process_request :DISP :F_DBG :Current request is not duplicate or not cacheable.                                                    
31/07/2019 07:30:59 : epoch 5d414351 : s04 : nfs-ganesha-1137[svc_51] nfs_req_creds :DISP :M_DBG :DISP: MID DEBUG: AUTH_SYS creds mapped to uid=999, gid=999, glen=3                                              
31/07/2019 07:30:59 : epoch 5d414351 : s04 : nfs-ganesha-1137[svc_51] nfs_rpc_process_request :DISP :F_DBG :Before svc_sendreply on socket 108                                                                    
31/07/2019 07:30:59 : epoch 5d414351 : s04 : nfs-ganesha-1137[svc_51] nfs_rpc_process_request :DISP :F_DBG :After svc_sendreply on socket 108                                                                     
31/07/2019 07:30:59 : epoch 5d414351 : s04 : nfs-ganesha-1137[svc_51] nfs_rpc_decode_request :DISP :DEBUG :SVC_DECODE on 0x7fb1780008c0 fd 108 (::ffff:10.10.249.16:873) xid=4251896795 returned XPRT_IDLE        
31/07/2019 07:30:59 : epoch 5d414351 : s04 : nfs-ganesha-1137[svc_51] free_nfs_request :DISP :DEBUG :free_nfs_request: 0x7fb1780008c0 fd 108 xp_refcnt 5 rq_refcnt 0
```

And the `tcpdump` output:
```text
15:30:13.330138 IP (tos 0x0, ttl 64, id 33974, offset 0, flags [DF], proto TCP (6), length 120)
    10.10.249.233.nfs > 10.10.249.1.833: Flags [P.], cksum 0x4962 (correct), seq 300:368, ack 849, win 285, options [nop,nop,TS val 2127034201 ecr 104935681], length 68                                          
15:30:13.330192 IP (tos 0x0, ttl 64, id 39227, offset 0, flags [DF], proto TCP (6), length 80)
    10.10.249.1.833 > 10.10.249.233.nfs: Flags [P.], cksum 0x0742 (incorrect -> 0x031b), seq 849:877, ack 368, win 60, options [nop,nop,TS val 104935684 ecr 2127034201], length 28                               
15:30:13.330302 IP (tos 0x0, ttl 64, id 33975, offset 0, flags [DF], proto TCP (6), length 180)
    10.10.249.233.nfs > 10.10.249.1.833: Flags [P.], cksum 0x07c5 (correct), seq 368:496, ack 877, win 285, options [nop,nop,TS val 2127034202 ecr 104935684], length 128: NFS reply xid 1180151899 reply ok 124  
15:30:13.330359 IP (tos 0x0, ttl 64, id 39228, offset 0, flags [DF], proto TCP (6), length 184)
    10.10.249.1.833 > 10.10.249.233.nfs: Flags [P.], cksum 0x07aa (incorrect -> 0xc56b), seq 877:1009, ack 496, win 62, options [nop,nop,TS val 104935684 ecr 2127034202], length 132: NFS request xid 1196929115 1
28 getattr fh 0,1/53
15:30:13.330499 IP (tos 0x0, ttl 64, id 33976, offset 0, flags [DF], proto TCP (6), length 168)
    10.10.249.233.nfs > 10.10.249.1.833: Flags [P.], cksum 0x3af5 (correct), seq 496:612, ack 1009, win 294, options [nop,nop,TS val 2127034202 ecr 104935684], length 116: NFS reply xid 1196929115 reply ok 112 g
etattr NON 3 ids 0/452984832 sz 1363362141
15:30:13.330567 IP (tos 0x0, ttl 64, id 39229, offset 0, flags [DF], proto TCP (6), length 176)
    10.10.249.1.833 > 10.10.249.233.nfs: Flags [P.], cksum 0x07a2 (incorrect -> 0xc76b), seq 1009:1133, ack 612, win 62, options [nop,nop,TS val 104935684 ecr 2127034202], length 124: NFS request xid 1213706331
120 getattr fh 0,1/53
15:30:13.330692 IP (tos 0x0, ttl 64, id 33977, offset 0, flags [DF], proto TCP (6), length 144)
    10.10.249.233.nfs > 10.10.249.1.833: Flags [P.], cksum 0x3d5d (correct), seq 612:704, ack 1133, win 294, options [nop,nop,TS val 2127034202 ecr 104935684], length 92: NFS reply xid 1213706331 reply ok 88 get
attr NON 2 ids 0/452984832 sz 1363362141
15:30:13.369774 IP (tos 0x0, ttl 64, id 39230, offset 0, flags [DF], proto TCP (6), length 52)
    10.10.249.1.833 > 10.10.249.233.nfs: Flags [.], cksum 0x0726 (incorrect -> 0x80c3), seq 1133, ack 704, win 62, options [nop,nop,TS val 104935724 ecr 2127034202], length 0
```

**Comment by malahal** [comment]
Does mounting with vers=4.0 or vers=3 work? Is this NFS4.2 version specific issue? Also, tcpdump can capture but can't display NFS protocol properly. You can use 'tshark' for display or  for capturing to get more details.

**Comment by Hughen** [comment]
@malahal 
Looks like reading and writing is normal when vers=3, v4.1 and v4.2 will be easy to reproduce the problem.

**Comment by Hughen** [comment]
add some `ganesha.nfsd` debug log:
```log
/07/2019 07:29:53 : epoch 5d414351 : s04 : nfs-ganesha-1137[svc_11] nfs_rpc_process_request :DISP :DEBUG :Request from ::ffff:10.10.249.1 for Program 100003, Version 4, Function 1 has xid=3848186649          
31/07/2019 07:29:53 : epoch 5d414351 : s04 : nfs-ganesha-1137[svc_11] nfs_rpc_process_request :DISP :F_DBG :Current request is not duplicate or not cacheable.                                                    
31/07/2019 07:29:53 : epoch 5d414351 : s04 : nfs-ganesha-1137[svc_11] nfs_req_creds :DISP :M_DBG :DISP: MID DEBUG: AUTH_SYS creds mapped to uid=0, gid=0, glen=1                                                  
31/07/2019 07:29:53 : epoch 5d414351 : s04 : nfs-ganesha-1137[svc_11] nfs_rpc_process_request :DISP :F_DBG :Before svc_sendreply on socket 109                                                                    
31/07/2019 07:29:53 : epoch 5d414351 : s04 : nfs-ganesha-1137[svc_11] nfs_rpc_process_request :DISP :F_DBG :After svc_sendreply on socket 109                                                                     
31/07/2019 07:29:53 : epoch 5d414351 : s04 : nfs-ganesha-1137[svc_11] nfs_rpc_decode_request :DISP :DEBUG :SVC_DECODE on 0x7fb198000c90 fd 109 (::ffff:10.10.249.1:733) xid=3848186649 returned XPRT_IDLE         
31/07/2019 07:29:53 : epoch 5d414351 : s04 : nfs-ganesha-1137[svc_11] free_nfs_request :DISP :DEBUG :free_nfs_request: 0x7fb198000c90 fd 109 xp_refcnt 5 rq_refcnt 0                                              
31/07/2019 07:29:53 : epoch 5d414351 : s04 : nfs-ganesha-1137[svc_2] nfs_rpc_decode_request :DISP :DEBUG :0x7fb198000c90 fd 109 context 0x7fb19c00a810                                                            
31/07/2019 07:29:53 : epoch 5d414351 : s04 : nfs-ganesha-1137[svc_2] nfs_rpc_process_request :DISP :F_DBG :About to authenticate Prog=100003, vers=4, proc=1, xid=3864963865, SVCXPRT=0x7fb198000c90, fd=109      
31/07/2019 07:29:53 : epoch 5d414351 : s04 : nfs-ganesha-1137[svc_2] nfs_rpc_process_request :DISP :F_DBG :Before SVCAUTH_CHECKSUM on SVCXPRT 0x7fb198000c90 fd 109                                               
31/07/2019 07:29:53 : epoch 5d414351 : s04 : nfs-ganesha-1137[svc_2] nfs_rpc_process_request :DISP :DEBUG :Request from ::ffff:10.10.249.1 for Program 100003, Version 4, Function 1 has xid=3864963865           
31/07/2019 07:29:53 : epoch 5d414351 : s04 : nfs-ganesha-1137[svc_2] nfs_rpc_process_request :DISP :F_DBG :Current request is not duplicate or not cacheable.                                                     
31/07/2019 07:29:53 : epoch 5d414351 : s04 : nfs-ganesha-1137[svc_2] nfs_rpc_process_request :DISP :F_DBG :Before svc_sendreply on socket 109                                                                     
31/07/2019 07:29:53 : epoch 5d414351 : s04 : nfs-ganesha-1137[svc_2] nfs_rpc_process_request :DISP :F_DBG :After svc_sendreply on socket 109                                                                      
31/07/2019 07:29:53 : epoch 5d414351 : s04 : nfs-ganesha-1137[svc_2] nfs_rpc_decode_request :DISP :DEBUG :SVC_DECODE on 0x7fb198000c90 fd 109 (::ffff:10.10.249.1:733) xid=3864963865 returned XPRT_IDLE          
31/07/2019 07:29:53 : epoch 5d414351 : s04 : nfs-ganesha-1137[svc_2] free_nfs_request :DISP :DEBUG :free_nfs_request: 0x7fb198000c90 fd 109 xp_refcnt 5 rq_refcnt 0                                               
31/07/2019 07:29:53 : epoch 5d414351 : s04 : nfs-ganesha-1137[svc_10] nfs_rpc_decode_request :DISP :DEBUG :0x7fb1780008c0 fd 108 context 0x7fb1740016d0                                                           
31/07/2019 07:29:53 : epoch 5d414351 : s04 : nfs-ganesha-1137[svc_10] nfs_rpc_process_request :DISP :F_DBG :About to authenticate Prog=100003, vers=4, proc=1, xid=3077491675, SVCXPRT=0x7fb1780008c0, fd=108     
31/07/2019 07:29:53 : epoch 5d414351 : s04 : nfs-ganesha-1137[svc_10] nfs_rpc_process_request :DISP :F_DBG :Before SVCAUTH_CHECKSUM on SVCXPRT 0x7fb1780008c0 fd 108                                              
31/07/2019 07:29:53 : epoch 5d414351 : s04 : nfs-ganesha-1137[svc_10] nfs_rpc_process_request :DISP :DEBUG :Request from ::ffff:10.10.249.16 for Program 100003, Version 4, Function 1 has xid=3077491675         
31/07/2019 07:29:53 : epoch 5d414351 : s04 : nfs-ganesha-1137[svc_10] nfs_rpc_process_request :DISP :F_DBG :Current request is not duplicate or not cacheable.                                                    
31/07/2019 07:29:53 : epoch 5d414351 : s04 : nfs-ganesha-1137[svc_10] nfs_rpc_process_request :DISP :F_DBG :Before svc_sendreply on socket 108                                                                    
31/07/2019 07:29:53 : epoch 5d414351 : s04 : nfs-ganesha-1137[svc_10] nfs_rpc_process_request :DISP :F_DBG :After svc_sendreply on socket 108                                                                     
31/07/2019 07:29:53 : epoch 5d414351 : s04 : nfs-ganesha-1137[svc_10] nfs_rpc_decode_request :DISP :DEBUG :SVC_DECODE on 0x7fb1780008c0 fd 108 (::ffff:10.10.249.16:873) xid=3077491675 returned XPRT_IDLE        
31/07/2019 07:29:53 : epoch 5d414351 : s04 : nfs-ganesha-1137[svc_10] free_nfs_request :DISP :DEBUG :free_nfs_request: 0x7fb1780008c0 fd 108 xp_refcnt 4 rq_refcnt 0                                              
31/07/2019 07:29:53 : epoch 5d414351 : s04 : nfs-ganesha-1137[svc_13] nfs_rpc_decode_request :DISP :DEBUG :0x7fb198000c90 fd 109 context 0x7fb16c0008c0                                                           
31/07/2019 07:29:53 : epoch 5d414351 : s04 : nfs-ganesha-1137[svc_13] nfs_rpc_process_request :DISP :F_DBG :About to authenticate Prog=100003, vers=4, proc=1, xid=3881741081, SVCXPRT=0x7fb198000c90, fd=109     
31/07/2019 07:29:53 : epoch 5d414351 : s04 : nfs-ganesha-1137[svc_13] nfs_rpc_process_request :DISP :F_DBG :Before SVCAUTH_CHECKSUM on SVCXPRT 0x7fb198000c90 fd 109                                              
31/07/2019 07:29:53 : epoch 5d414351 : s04 : nfs-ganesha-1137[svc_13] nfs_rpc_process_request :DISP :DEBUG :Request from ::ffff:10.10.249.1 for Program 100003, Version 4, Function 1 has xid=3881741081          
31/07/2019 07:29:53 : epoch 5d414351 : s04 : nfs-ganesha-1137[svc_13] nfs_rpc_process_request :DISP :F_DBG :Current request is not duplicate or not cacheable.                                                    
31/07/2019 07:29:53 : epoch 5d414351 : s04 : nfs-ganesha-1137[svc_13] nfs_req_creds :DISP :M_DBG :DISP: MID DEBUG: AUTH_SYS creds mapped to uid=0, gid=0, glen=1                                                  
31/07/2019 07:29:53 : epoch 5d414351 : s04 : nfs-ganesha-1137[svc_8] nfs_rpc_decode_request :DISP :DEBUG :0x7fb1780008c0 fd 108 context 0x7fb154003350                                                            
31/07/2019 07:29:53 : epoch 5d414351 : s04 : nfs-ganesha-1137[svc_8] nfs_rpc_process_request :DISP :F_DBG :About to authenticate Prog=100003, vers=4, proc=1, xid=3094268891, SVCXPRT=0x7fb1780008c0, fd=108      
31/07/2019 07:29:53 : epoch 5d414351 : s04 : nfs-ganesha-1137[svc_8] nfs_rpc_process_request :DISP :F_DBG :Before SVCAUTH_CHECKSUM on SVCXPRT 0x7fb1780008c0 fd 108                                               
31/07/2019 07:29:53 : epoch 5d414351 : s04 : nfs-ganesha-1137[svc_8] nfs_rpc_process_request :DISP :DEBUG :Request from ::ffff:10.10.249.16 for Program 100003, Version 4, Function 1 has xid=3094268891          
31/07/2019 07:29:53 : epoch 5d414351 : s04 : nfs-ganesha-1137[svc_8] nfs_rpc_process_request :DISP :F_DBG :Current request is not duplicate or not cacheable.                                                     
31/07/2019 07:29:53 : epoch 5d414351 : s04 : nfs-ganesha-1137[svc_13] nfs_rpc_process_request :DISP :F_DBG :Before svc_sendreply on socket 109                                                                    
31/07/2019 07:29:53 : epoch 5d414351 : s04 : nfs-ganesha-1137[svc_13] rpc :TIRPC :EVENT :svc_vc_reply: 0x7fb198000c90 fd 109 SVCAUTH_WRAP failed (will set dead)                                                  
31/07/2019 07:29:53 : epoch 5d414351 : s04 : nfs-ganesha-1137[svc_13] nfs_rpc_process_request :DISP :DEBUG :NFS DISPATCHER: FAILURE: Error while calling svc_sendreply on a new request. rpcxid=3881741081 socket=109 function:nfs4_Comp client:::ffff:10.10.249.1 program:100003 nfs version:4 proc:1 errno: 0
```

**Comment by Hughen** [comment]
`tshark` output:
```text
48283 361.265779528 10.10.249.233 → 10.10.249.1  TCP 68 2049 → 823 [ACK] Seq=28685 Ack=173733629 Win=2787456 Len=0 TSval=480780669 TSecr=113991549                                                        [28/3496]
48284 361.266169703 10.10.249.233 → 10.10.249.1  TCP 68 2049 → 823 [ACK] Seq=28685 Ack=174104317 Win=2787456 Len=0 TSval=480780670 TSecr=113991549                                                                
48285 361.266252489 10.10.249.233 → 10.10.249.1  TCP 68 2049 → 823 [ACK] Seq=28685 Ack=174109081 Win=2787456 Len=0 TSval=480780670 TSecr=113991550                                                                
48286 361.280589257 10.10.249.233 → 10.10.249.1  NFS 184 V4 Reply (Call In 48282) WRITE
48287 361.280849166  10.10.249.1 → 10.10.249.233 TCP 65228 823 → 2049 [ACK] Seq=174109081 Ack=28801 Win=59392 Len=65160 TSval=113991565 TSecr=480780684 [TCP segment of a reassembled PDU]                        
48288 361.280865425  10.10.249.1 → 10.10.249.233 TCP 65228 823 → 2049 [ACK] Seq=174174241 Ack=28801 Win=59392 Len=65160 TSval=113991565 TSecr=480780684 [TCP segment of a reassembled PDU]                        
48289 361.280880378  10.10.249.1 → 10.10.249.233 TCP 65228 823 → 2049 [ACK] Seq=174239401 Ack=28801 Win=59392 Len=65160 TSval=113991565 TSecr=480780684 [TCP segment of a reassembled PDU]                        
48290 361.280892821  10.10.249.1 → 10.10.249.233 TCP 65228 823 → 2049 [ACK] Seq=174304561 Ack=28801 Win=59392 Len=65160 TSval=113991565 TSecr=480780684 [TCP segment of a reassembled PDU]                        
48291 361.280956756  10.10.249.1 → 10.10.249.233 TCP 65228 823 → 2049 [ACK] Seq=174369721 Ack=28801 Win=59392 Len=65160 TSval=113991565 TSecr=480780684 [TCP segment of a reassembled PDU]                        
48292 361.280967840  10.10.249.1 → 10.10.249.233 TCP 65228 823 → 2049 [ACK] Seq=174434881 Ack=28801 Win=59392 Len=65160 TSval=113991565 TSecr=480780684 [TCP segment of a reassembled PDU]                        
48293 361.281033845  10.10.249.1 → 10.10.249.233 TCP 65228 823 → 2049 [ACK] Seq=174500041 Ack=28801 Win=59392 Len=65160 TSval=113991565 TSecr=480780684 [TCP segment of a reassembled PDU]                        
48294 361.281041975  10.10.249.1 → 10.10.249.233 TCP 65228 823 → 2049 [ACK] Seq=174565201 Ack=28801 Win=59392 Len=65160 TSval=113991565 TSecr=480780684 [TCP segment of a reassembled PDU]                        
48295 361.281049552  10.10.249.1 → 10.10.249.233 TCP 65228 823 → 2049 [ACK] Seq=174630361 Ack=28801 Win=59392 Len=65160 TSval=113991565 TSecr=480780684 [TCP segment of a reassembled PDU]                        
48296 361.281114875  10.10.249.1 → 10.10.249.233 TCP 65228 823 → 2049 [ACK] Seq=174695521 Ack=28801 Win=59392 Len=65160 TSval=113991565 TSecr=480780684 [TCP segment of a reassembled PDU]                        
48297 361.281135247 10.10.249.233 → 10.10.249.1  TCP 68 2049 → 823 [ACK] Seq=28801 Ack=174201753 Win=2722048 Len=0 TSval=480780685 TSecr=113991565                                                                
48298 361.281199870  10.10.249.1 → 10.10.249.233 TCP 65228 823 → 2049 [ACK] Seq=174760681 Ack=28801 Win=59392 Len=65160 TSval=113991565 TSecr=480780685 [TCP segment of a reassembled PDU]                        
48299 361.281210212  10.10.249.1 → 10.10.249.233 TCP 65228 823 → 2049 [ACK] Seq=174825841 Ack=28801 Win=59392 Len=65160 TSval=113991565 TSecr=480780685 [TCP segment of a reassembled PDU]                        
48300 361.281278840  10.10.249.1 → 10.10.249.233 TCP 65228 823 → 2049 [ACK] Seq=174891001 Ack=28801 Win=59392 Len=65160 TSval=113991565 TSecr=480780685 [TCP segment of a reassembled PDU]                        
48301 361.281295279 10.10.249.233 → 10.10.249.1  TCP 68 2049 → 823 [ACK] Seq=28801 Ack=174266913 Win=2787456 Len=0 TSval=480780685 TSecr=113991565                                                                
48302 361.281362030  10.10.249.1 → 10.10.249.233 TCP 65228 823 → 2049 [ACK] Seq=174956161 Ack=28801 Win=59392 Len=65160 TSval=113991565 TSecr=480780685 [TCP segment of a reassembled PDU]                        
48303 361.281370479  10.10.249.1 → 10.10.249.233 TCP 65228 823 → 2049 [ACK] Seq=175021321 Ack=28801 Win=59392 Len=65160 TSval=113991565 TSecr=480780685 [TCP segment of a reassembled PDU]                        
48304 361.281450279  10.10.249.1 → 10.10.249.233 TCP 65228 823 → 2049 [ACK] Seq=175086481 Ack=28801 Win=59392 Len=65160 TSval=113991566 TSecr=480780685 [TCP segment of a reassembled PDU]                        
48305 361.281525016  10.10.249.1 → 10.10.249.233 NFS 6280 V4 Call WRITE StateID: 0xaa04 Offset: 171966464 Len: 1048576                                                                                            
48306 361.281583374 10.10.249.233 → 10.10.249.1  TCP 68 2049 → 823 [ACK] Seq=28801 Ack=174479769 Win=2787456 Len=0 TSval=480780685 TSecr=113991565                                                                
48307 361.281922360 10.10.249.233 → 10.10.249.1  TCP 68 2049 → 823 [ACK] Seq=28801 Ack=174760681 Win=2787456 Len=0 TSval=480780685 TSecr=113991565                                                                
48308 361.282383282 10.10.249.233 → 10.10.249.1  TCP 68 2049 → 823 [ACK] Seq=28801 Ack=175157853 Win=2787456 Len=0 TSval=480780686 TSecr=113991565                                                                
48309 361.282977244 10.10.249.233 → 10.10.249.1  NFS 116 V4 Reply (Call In 48305) SEQUENCE Status: NFS4ERR_BADSESSION                                                                                             
48310 361.283036958  10.10.249.1 → 10.10.249.233 NFS 168 V4 Call DESTROY_SESSION
48311 361.283244464 10.10.249.233 → 10.10.249.1  NFS 116 V4 Reply (Call In 48310) DESTROY_SESSION Status: NFS4ERR_BADSESSION                                                                                      
48312 361.283259672  10.10.249.1 → 10.10.249.233 NFS 260 V4 Call CREATE_SESSION
48313 361.283656573 10.10.249.233 → 10.10.249.1  NFS 116 V4 Reply (Call In 48312) CREATE_SESSION Status: NFS4ERR_STALE_CLIENTID                                                                                   
48314 361.283691666  10.10.249.1 → 10.10.249.233 NFS 316 V4 Call EXCHANGE_ID
48315 361.284131182 10.10.249.233 → 10.10.249.1  NFS 176 V4 Reply (Call In 48314) EXCHANGE_ID
48316 361.284160138  10.10.249.1 → 10.10.249.233 NFS 260 V4 Call CREATE_SESSION
48317 361.287194117 10.10.249.233 → 10.10.249.1  NFS CB 136 V1 CB_NULL Call                                                                                                                                       
48318 361.287244835  10.10.249.1 → 10.10.249.233 NFS CB 96 V1 CB_NULL Reply (Call In 48317)                                                                                                                       
48319 361.287500565 10.10.249.233 → 10.10.249.1  NFS 196 V4 Reply (Call In 48316) CREATE_SESSION
48320 361.287536751  10.10.249.1 → 10.10.249.233 NFS 200 V4 Call PUTROOTFH | GETATTR                                                                                                                              
48321 361.287837320 10.10.249.233 → 10.10.249.1  NFS 184 V4 Reply (Call In 48320) PUTROOTFH | GETATTR
48322 361.287880758  10.10.249.1 → 10.10.249.233 NFS 312 V4 Call OPEN DH: 0x3b84e131/                                                                                                                             
48323 361.288046625 10.10.249.233 → 10.10.249.1  NFS 116 V4 Reply (Call In 48322) SEQUENCE Status: NFS4ERR_BADSESSION                                                                                             
48324 361.288064288  10.10.249.1 → 10.10.249.233 NFS 168 V4 Call DESTROY_SESSION                                                                                                                                  
48325 361.288195634 10.10.249.233 → 10.10.249.1  NFS 116 V4 Reply (Call In 48324) DESTROY_SESSION Status: NFS4ERR_BADSESSION                                                                                      
48326 361.288205535  10.10.249.1 → 10.10.249.233 NFS 260 V4 Call CREATE_SESSION
48327 361.288988353 10.10.249.233 → 10.10.249.1  NFS 116 V4 Reply (Call In 48326) CREATE_SESSION Status: NFS4ERR_STALE_CLIENTID                                                                                   
48328 361.289020797  10.10.249.1 → 10.10.249.233 NFS 316 V4 Call EXCHANGE_ID
48329 361.290350904 10.10.249.233 → 10.10.249.1  NFS 176 V4 Reply (Call In 48328) EXCHANGE_ID
48330 361.290380692  10.10.249.1 → 10.10.249.233 NFS 260 V4 Call CREATE_SESSION
48331 361.293275213 10.10.249.233 → 10.10.249.1  NFS CB 136 V1 CB_NULL Call
48332 361.293312518  10.10.249.1 → 10.10.249.233 NFS CB 96 V1 CB_NULL Reply (Call In 48331)
48333 361.293534313 10.10.249.233 → 10.10.249.1  NFS 196 V4 Reply (Call In 48330) CREATE_SESSION
48334 361.293558061  10.10.249.1 → 10.10.249.233 NFS 200 V4 Call PUTROOTFH | GETATTR
48335 361.293737059 10.10.249.233 → 10.10.249.1  NFS 184 V4 Reply (Call In 48334) PUTROOTFH | GETATTR                                                                                                             
48336 361.293757464  10.10.249.1 → 10.10.249.233 NFS 312 V4 Call OPEN DH: 0x3b84e131/
48337 361.293962480 10.10.249.233 → 10.10.249.1  NFS 168 V4 Reply (Call In 48336) OPEN Status: NFS4ERR_NO_GRACE                                                                                                   
48338 361.293979611  10.10.249.1 → 10.10.249.233 NFS 192 V4 Call RECLAIM_COMPLETE
48339 361.294143522 10.10.249.233 → 10.10.249.1  NFS 160 V4 Reply (Call In 48338) RECLAIM_COMPLETE
48340 361.294158566  10.10.249.1 → 10.10.249.233 NFS 312 V4 Call OPEN DH: 0x3b84e131/
48341 361.335606461 10.10.249.233 → 10.10.249.1  TCP 68 2049 → 823 [ACK] Seq=30121 Ack=175160493 Win=2787456 Len=0 TSval=480780739 TSecr=113991578                                                                
```

`ganesha.nfsd` log: (cmd: `ganesha.nfsd -F -L STDOUT`)
```log
2019-07-31 10:01:08.549636 I | 31/07/2019 10:01:08 : epoch 5d401833 : s04 : nfs-ganesha-29[svc_117] rpc :TIRPC :EVENT :svc_vc_reply: 0x7f2b00006410 fd 59 SVCAUTH_WRAP failed (will set dead)
```

**Comment by dang** [comment]
So, all the log tells us is that an encode failed for some reason, but nothing else, even what op it was.  Can you turn on FULL_DEBUG and get another log?

**Comment by Hughen** [comment]
em...
When an error like "`rpc :TIRPC :EVENT :svc_vc_reply: 0x7f2b00006410 fd 59 SVCAUTH_WRAP failed (will set dead)`" occurs, the nfs client cannot continue reading and writing data, and after remounting, it captures the packet. Found that only a small number of requests have been read and written, and then client is hangs.

**Comment by Hughen** [comment]
@dang 
Hi, I grabbed a debug log and `pcap` data again. 
Server IP: `10.10.249.233`
Client IP: `10.10.249.6`
Running `dd if=./6g.txt of=/dev/null iflag=direct bs=1M count=1024` in client to read a file from nfs server, but it has been hangs for a long long time.

Server Log: [server.log](https://github.com/nfs-ganesha/nfs-ganesha/files/3460919/server.log)
pcap: [tshark-nfs.pcap.tar.gz](https://github.com/nfs-ganesha/nfs-ganesha/files/3460935/tshark-nfs.pcap.tar.gz), the file is captured `pcap` log on the client.

**Comment by ffilz** [comment]
Closing this due to age, feel free to re-open if it's still of interest and you have explored using a currently supported version of Ganesha (V2.8 or V3 at this time).
