### ISSUE TITLE
NFS mount breaks on container recreation

### ISSUE THREAD

**Issue by Rid** [nfs-ganesha/nfs-ganesha#825]
Firstly, thanks for all your hardwork on this project throughout the years!

I'm running nfs-ganesha on kubernetes with a service endpoint forwarding packets to the container. When a node goes offline the container for nfs-ganesha is rescheduled onto another node. The service endpoint maintains the same IP address.

It's mounted as follows:

```
10.68.169.143:/export/pvc-f0d21f1c-01f9-42e4-964b-2577ca3cf68c on /mattermost/data type nfs (rw,relatime,vers=3,rsize=1048576,wsize=1048576,namlen=255,soft,proto=tcp,timeo=10,retrans=2,sec=sys,mountaddr=10.68.169.143,mountvers=3,mountport=20048,mountproto=tcp,local_lock=none,addr=10.68.169.143)
```

```
bash-5.1# ganesha.nfsd -v
NFS-Ganesha Release = V4.0.5
```

The server is setup as follows:

```
bash-5.1# cat /export/vfs.conf

###################################################
#
# EXPORT
#
# To function, all that is required is an EXPORT
#
# Define the absolute minimal export
#
###################################################

EXPORT
{
	# Export Id (mandatory, each EXPORT must have a unique Export_Id)
	Export_Id = 0;

	# Exported path (mandatory)
	Path = /nonexistent;

	# Pseudo Path (required for NFS v4)
	Pseudo = /nonexistent;

	# Required for access (default is None)
	# Could use CLIENT blocks instead
	Access_Type = RW;

	# Exporting FSAL
	FSAL {
		Name = VFS;
	}
}

NFS_Core_Param
{
	MNT_Port = 20048;
	NLM_Port = 32803;
	fsid_device = false;
}

NFSV4
{
	Grace_Period = 90;
}

EXPORT
{
	Export_Id = 1;
	Path = /export/pvc-f0d21f1c-01f9-42e4-964b-2577ca3cf68c;
	Pseudo = /export/pvc-f0d21f1c-01f9-42e4-964b-2577ca3cf68c;
	Access_Type = RW;
	Squash = no_root_squash;
	SecType = sys;
	Filesystem_id = 1.1;
	FSAL {
		Name = VFS;
	}
}
```

Trying to access the mount once the container has been re-created results in:

```
~ $ ls -la /mattermost/data
ls: /mattermost/data: I/O error
```

If I try to mount to a different directory on the same node as the existing mount, it fails with:

```
# mount -t nfs -o rw,relatime,vers=3,rsize=1048576,wsize=1048576,namlen=255,soft,proto=tcp,timeo=10,retrans=2,sec=sys,mountaddr=10.68.169.143,mountvers=3,mountport=20048,mountproto=tcp,local_lock=none,addr=10.68.169.143 10.68.169.143:/export/pvc-f0d21f1c-01f9-42e4-964b-2577ca3cf68c /tmp/nfs/
mount.nfs: mount system call failed
```

Here's an strace of the mount attempt:

```
[pid 167216] openat(AT_FDCWD, "/etc/netconfig", O_RDONLY) = 3
[pid 167216] fstat(3, {st_mode=S_IFREG|0644, st_size=767, ...}) = 0
[pid 167216] read(3, "#\n# The network configuration fi"..., 1024) = 767
[pid 167216] close(3)                   = 0
[pid 167216] mount("10.68.169.143:/export/pvc-f0d21f1c-01f9-42e4-964b-2577ca3cf68c", "/tmp/nfs", "nfs", MS_RELATIME, "rsize=1048576,wsize=1048576,naml"...) = -1 EIO (Input/output error)
[pid 167216] write(2, "mount.nfs: mount system call fai"..., 36mount.nfs: mount system call failed
) = 36
[pid 167216] getuid()                   = 0
[pid 167216] geteuid()                  = 0
[pid 167216] getgid()                   = 0
[pid 167216] getegid()                  = 0
[pid 167216] prctl(PR_GET_DUMPABLE)     = 1 (SUID_DUMP_USER)
[pid 167216] stat("/run", {st_mode=S_IFDIR|0755, st_size=920, ...}) = 0
[pid 167216] lstat("/run/mount/utab", {st_mode=S_IFREG|0644, st_size=781, ...}) = 0
[pid 167216] stat("/run/mount/utab", {st_mode=S_IFREG|0644, st_size=781, ...}) = 0
[pid 167216] geteuid()                  = 0
[pid 167216] getegid()                  = 0
[pid 167216] getuid()                   = 0
[pid 167216] getgid()                   = 0
[pid 167216] access("/run/mount/utab", R_OK|W_OK) = 0
[pid 167216] exit_group(32)             = ?
[pid 167216] +++ exited with 32 +++
<... wait4 resumed>[{WIFEXITED(s) && WEXITSTATUS(s) == 32}], 0, NULL) = 167216
--- SIGCHLD {si_signo=SIGCHLD, si_code=CLD_EXITED, si_pid=167216, si_uid=0, si_status=32, si_utime=1, si_stime=7} ---
close(1)                                = 0
close(2)                                = 0
exit_group(32)                          = ?
+++ exited with 32 +++
```

Here is the tcpdump for the above, it appears that the packets are received by the node:

```
16:23:55.735684 IP (tos 0x0, ttl 64, id 16588, offset 0, flags [DF], proto TCP (6), length 52)
    10.0.0.175.41360 > 23.106.61.232.6443: Flags [.], cksum 0x6027 (incorrect -> 0x2421), seq 1785915754, ack 2458443190, win 467, options [nop,nop,TS val 227993623 ecr 2011694170], length 0
	0x0000:  4500 0034 40cc 4000 4006 99f7 0a00 00af  E..4@.@.@.......
	0x0010:  176a 3de8 a190 192b 6a72 e96a 9288 ddb6  .j=....+jr.j....
	0x0020:  8010 01d3 6027 0000 0101 080a 0d96 e817  ....`'..........
	0x0030:  77e8 045a                                w..Z
16:23:55.736027 IP (tos 0x0, ttl 61, id 49285, offset 0, flags [DF], proto TCP (6), length 52)
    23.106.61.232.6443 > 10.0.0.175.41360: Flags [.], cksum 0x23fd (correct), seq 1, ack 1, win 501, options [nop,nop,TS val 2011724208 ecr 227963586], length 0
	0x0000:  4500 0034 c085 4000 3d06 1d3e 176a 3de8  E..4..@.=..>.j=.
	0x0010:  0a00 00af 192b a190 9288 ddb6 6a72 e96b  .....+......jr.k
	0x0020:  8010 01f5 23fd 0000 0101 080a 77e8 79b0  ....#.......w.y.
	0x0030:  0d96 72c2                                ..r.
16:23:57.392138 IP (tos 0x0, ttl 64, id 52664, offset 0, flags [DF], proto TCP (6), length 60)
    10.0.4.242.34848 > 10.0.0.175.111: Flags [S], cksum 0x7b46 (correct), seq 401751378, win 64860, options [mss 1410,sackOK,TS val 1993236811 ecr 0,nop,wscale 8], length 0
	0x0000:  4500 003c cdb8 4000 4006 5363 0a00 04f2  E..<..@.@.Sc....
	0x0010:  0a00 00af 8820 006f 17f2 3d52 0000 0000  .......o..=R....
	0x0020:  a002 fd5c 7b46 0000 0204 0582 0402 080a  ...\{F..........
	0x0030:  76ce 614b 0000 0000 0103 0308            v.aK........
16:23:57.392198 IP (tos 0x0, ttl 63, id 52664, offset 0, flags [DF], proto TCP (6), length 60)
    10.0.4.242.34848 > 10.0.0.175.111: Flags [S], cksum 0x7b46 (correct), seq 401751378, win 64860, options [mss 1410,sackOK,TS val 1993236811 ecr 0,nop,wscale 8], length 0
	0x0000:  4500 003c cdb8 4000 3f06 5463 0a00 04f2  E..<..@.?.Tc....
	0x0010:  0a00 00af 8820 006f 17f2 3d52 0000 0000  .......o..=R....
	0x0020:  a002 fd5c 7b46 0000 0204 0582 0402 080a  ...\{F..........
	0x0030:  76ce 614b 0000 0000 0103 0308            v.aK........
16:23:57.392226 IP (tos 0x0, ttl 64, id 0, offset 0, flags [DF], proto TCP (6), length 60)
    10.0.0.175.111 > 10.0.4.242.34848: Flags [S.], cksum 0x19cf (incorrect -> 0xf39e), seq 2571821105, ack 401751379, win 64308, options [mss 1410,sackOK,TS val 4112325412 ecr 1993236811,nop,wscale 8], length 0
	0x0000:  4500 003c 0000 4000 4006 211c 0a00 00af  E..<..@.@.!.....
	0x0010:  0a00 04f2 006f 8820 994a e031 17f2 3d53  .....o...J.1..=S
	0x0020:  a012 fb34 19cf 0000 0204 0582 0402 080a  ...4............
	0x0030:  f51d 1b24 76ce 614b 0103 0308            ...$v.aK....
16:23:57.392242 IP (tos 0x0, ttl 64, id 0, offset 0, flags [DF], proto TCP (6), length 60)
    10.0.0.175.111 > 10.0.4.242.34848: Flags [S.], cksum 0x19cf (incorrect -> 0xf39e), seq 2571821105, ack 401751379, win 64308, options [mss 1410,sackOK,TS val 4112325412 ecr 1993236811,nop,wscale 8], length 0
	0x0000:  4500 003c 0000 4000 4006 211c 0a00 00af  E..<..@.@.!.....
	0x0010:  0a00 04f2 006f 8820 994a e031 17f2 3d53  .....o...J.1..=S
	0x0020:  a012 fb34 19cf 0000 0204 0582 0402 080a  ...4............
	0x0030:  f51d 1b24 76ce 614b 0103 0308            ...$v.aK....
16:23:57.392681 IP (tos 0x0, ttl 64, id 52665, offset 0, flags [DF], proto TCP (6), length 52)
    10.0.4.242.34848 > 10.0.0.175.111: Flags [.], cksum 0x1c70 (correct), seq 1, ack 1, win 254, options [nop,nop,TS val 1993236812 ecr 4112325412], length 0
	0x0000:  4500 0034 cdb9 4000 4006 536a 0a00 04f2  E..4..@.@.Sj....
	0x0010:  0a00 00af 8820 006f 17f2 3d53 994a e032  .......o..=S.J.2
	0x0020:  8010 00fe 1c70 0000 0101 080a 76ce 614c  .....p......v.aL
	0x0030:  f51d 1b24                                ...$
16:23:57.392721 IP (tos 0x0, ttl 63, id 52665, offset 0, flags [DF], proto TCP (6), length 52)
    10.0.4.242.34848 > 10.0.0.175.111: Flags [.], cksum 0x1c70 (correct), seq 1, ack 1, win 254, options [nop,nop,TS val 1993236812 ecr 4112325412], length 0
	0x0000:  4500 0034 cdb9 4000 3f06 546a 0a00 04f2  E..4..@.?.Tj....
	0x0010:  0a00 00af 8820 006f 17f2 3d53 994a e032  .......o..=S.J.2
	0x0020:  8010 00fe 1c70 0000 0101 080a 76ce 614c  .....p......v.aL
	0x0030:  f51d 1b24                                ...$
16:23:57.418410 IP (tos 0x0, ttl 64, id 52666, offset 0, flags [DF], proto TCP (6), length 112)
    10.0.4.242.34848 > 10.0.0.175.111: Flags [P.], cksum 0x44b5 (correct), seq 1:61, ack 1, win 254, options [nop,nop,TS val 1993236838 ecr 4112325412], length 60
	0x0000:  4500 0070 cdba 4000 4006 532d 0a00 04f2  E..p..@.@.S-....
	0x0010:  0a00 00af 8820 006f 17f2 3d53 994a e032  .......o..=S.J.2
	0x0020:  8018 00fe 44b5 0000 0101 080a 76ce 6166  ....D.......v.af
	0x0030:  f51d 1b24 8000 0038 f080 594d 0000 0000  ...$...8..YM....
	0x0040:  0000 0002 0001 86a0 0000 0002 0000 0003  ................
	0x0050:  0000 0000 0000 0000 0000 0000 0000 0000  ................
	0x0060:  0001 86a3 0000 0003 0000 0006 0000 0000  ................
16:23:57.418450 IP (tos 0x0, ttl 63, id 52666, offset 0, flags [DF], proto TCP (6), length 112)
    10.0.4.242.34848 > 10.0.0.175.111: Flags [P.], cksum 0x44b5 (correct), seq 1:61, ack 1, win 254, options [nop,nop,TS val 1993236838 ecr 4112325412], length 60
	0x0000:  4500 0070 cdba 4000 3f06 542d 0a00 04f2  E..p..@.?.T-....
	0x0010:  0a00 00af 8820 006f 17f2 3d53 994a e032  .......o..=S.J.2
	0x0020:  8018 00fe 44b5 0000 0101 080a 76ce 6166  ....D.......v.af
	0x0030:  f51d 1b24 8000 0038 f080 594d 0000 0000  ...$...8..YM....
	0x0040:  0000 0002 0001 86a0 0000 0002 0000 0003  ................
	0x0050:  0000 0000 0000 0000 0000 0000 0000 0000  ................
	0x0060:  0001 86a3 0000 0003 0000 0006 0000 0000  ................
16:23:57.418468 IP (tos 0x0, ttl 64, id 11211, offset 0, flags [DF], proto TCP (6), length 52)
    10.0.0.175.111 > 10.0.4.242.34848: Flags [.], cksum 0x19c7 (incorrect -> 0x1c03), seq 1, ack 61, win 251, options [nop,nop,TS val 4112325438 ecr 1993236838], length 0
	0x0000:  4500 0034 2bcb 4000 4006 f558 0a00 00af  E..4+.@.@..X....
	0x0010:  0a00 04f2 006f 8820 994a e032 17f2 3d8f  .....o...J.2..=.
	0x0020:  8010 00fb 19c7 0000 0101 080a f51d 1b3e  ...............>
	0x0030:  76ce 6166                                v.af
16:23:57.418475 IP (tos 0x0, ttl 64, id 11211, offset 0, flags [DF], proto TCP (6), length 52)
    10.0.0.175.111 > 10.0.4.242.34848: Flags [.], cksum 0x19c7 (incorrect -> 0x1c03), seq 1, ack 61, win 251, options [nop,nop,TS val 4112325438 ecr 1993236838], length 0
	0x0000:  4500 0034 2bcb 4000 4006 f558 0a00 00af  E..4+.@.@..X....
	0x0010:  0a00 04f2 006f 8820 994a e032 17f2 3d8f  .....o...J.2..=.
	0x0020:  8010 00fb 19c7 0000 0101 080a f51d 1b3e  ...............>
	0x0030:  76ce 6166                                v.af
16:23:57.418518 IP (tos 0x0, ttl 64, id 11212, offset 0, flags [DF], proto TCP (6), length 84)
    10.0.0.175.111 > 10.0.4.242.34848: Flags [P.], cksum 0x19e7 (incorrect -> 0x49ee), seq 1:33, ack 61, win 251, options [nop,nop,TS val 4112325438 ecr 1993236838], length 32
	0x0000:  4500 0054 2bcc 4000 4006 f537 0a00 00af  E..T+.@.@..7....
	0x0010:  0a00 04f2 006f 8820 994a e032 17f2 3d8f  .....o...J.2..=.
	0x0020:  8018 00fb 19e7 0000 0101 080a f51d 1b3e  ...............>
	0x0030:  76ce 6166 8000 001c f080 594d 0000 0001  v.af......YM....
	0x0040:  0000 0000 0000 0000 0000 0000 0000 0000  ................
	0x0050:  0000 0801                                ....
16:23:57.418549 IP (tos 0x0, ttl 64, id 11212, offset 0, flags [DF], proto TCP (6), length 84)
    10.0.0.175.111 > 10.0.4.242.34848: Flags [P.], cksum 0x19e7 (incorrect -> 0x49ee), seq 1:33, ack 61, win 251, options [nop,nop,TS val 4112325438 ecr 1993236838], length 32
	0x0000:  4500 0054 2bcc 4000 4006 f537 0a00 00af  E..T+.@.@..7....
	0x0010:  0a00 04f2 006f 8820 994a e032 17f2 3d8f  .....o...J.2..=.
	0x0020:  8018 00fb 19e7 0000 0101 080a f51d 1b3e  ...............>
	0x0030:  76ce 6166 8000 001c f080 594d 0000 0001  v.af......YM....
	0x0040:  0000 0000 0000 0000 0000 0000 0000 0000  ................
	0x0050:  0000 0801                                ....
16:23:57.418923 IP (tos 0x0, ttl 64, id 52667, offset 0, flags [DF], proto TCP (6), length 52)
    10.0.4.242.34848 > 10.0.0.175.111: Flags [.], cksum 0x1be0 (correct), seq 61, ack 33, win 254, options [nop,nop,TS val 1993236838 ecr 4112325438], length 0
	0x0000:  4500 0034 cdbb 4000 4006 5368 0a00 04f2  E..4..@.@.Sh....
	0x0010:  0a00 00af 8820 006f 17f2 3d8f 994a e052  .......o..=..J.R
	0x0020:  8010 00fe 1be0 0000 0101 080a 76ce 6166  ............v.af
	0x0030:  f51d 1b3e                                ...>
16:23:57.418936 IP (tos 0x0, ttl 63, id 52667, offset 0, flags [DF], proto TCP (6), length 52)
    10.0.4.242.34848 > 10.0.0.175.111: Flags [.], cksum 0x1be0 (correct), seq 61, ack 33, win 254, options [nop,nop,TS val 1993236838 ecr 4112325438], length 0
	0x0000:  4500 0034 cdbb 4000 3f06 5468 0a00 04f2  E..4..@.?.Th....
	0x0010:  0a00 00af 8820 006f 17f2 3d8f 994a e052  .......o..=..J.R
	0x0020:  8010 00fe 1be0 0000 0101 080a 76ce 6166  ............v.af
	0x0030:  f51d 1b3e                                ...>
16:23:57.419010 IP (tos 0x0, ttl 64, id 52668, offset 0, flags [DF], proto TCP (6), length 52)
    10.0.4.242.34848 > 10.0.0.175.111: Flags [F.], cksum 0x1bdf (correct), seq 61, ack 33, win 254, options [nop,nop,TS val 1993236838 ecr 4112325438], length 0
	0x0000:  4500 0034 cdbc 4000 4006 5367 0a00 04f2  E..4..@.@.Sg....
	0x0010:  0a00 00af 8820 006f 17f2 3d8f 994a e052  .......o..=..J.R
	0x0020:  8011 00fe 1bdf 0000 0101 080a 76ce 6166  ............v.af
	0x0030:  f51d 1b3e                                ...>
16:23:57.419025 IP (tos 0x0, ttl 63, id 52668, offset 0, flags [DF], proto TCP (6), length 52)
    10.0.4.242.34848 > 10.0.0.175.111: Flags [F.], cksum 0x1bdf (correct), seq 61, ack 33, win 254, options [nop,nop,TS val 1993236838 ecr 4112325438], length 0
	0x0000:  4500 0034 cdbc 4000 3f06 5467 0a00 04f2  E..4..@.?.Tg....
	0x0010:  0a00 00af 8820 006f 17f2 3d8f 994a e052  .......o..=..J.R
	0x0020:  8011 00fe 1bdf 0000 0101 080a 76ce 6166  ............v.af
	0x0030:  f51d 1b3e                                ...>
16:23:57.419049 IP (tos 0x0, ttl 64, id 11213, offset 0, flags [DF], proto TCP (6), length 52)
    10.0.0.175.111 > 10.0.4.242.34848: Flags [F.], cksum 0x19c7 (incorrect -> 0x1be0), seq 33, ack 62, win 251, options [nop,nop,TS val 4112325439 ecr 1993236838], length 0
	0x0000:  4500 0034 2bcd 4000 4006 f556 0a00 00af  E..4+.@.@..V....
	0x0010:  0a00 04f2 006f 8820 994a e052 17f2 3d90  .....o...J.R..=.
	0x0020:  8011 00fb 19c7 0000 0101 080a f51d 1b3f  ...............?
	0x0030:  76ce 6166                                v.af
16:23:57.419059 IP (tos 0x0, ttl 64, id 11213, offset 0, flags [DF], proto TCP (6), length 52)
    10.0.0.175.111 > 10.0.4.242.34848: Flags [F.], cksum 0x19c7 (incorrect -> 0x1be0), seq 33, ack 62, win 251, options [nop,nop,TS val 4112325439 ecr 1993236838], length 0
	0x0000:  4500 0034 2bcd 4000 4006 f556 0a00 00af  E..4+.@.@..V....
	0x0010:  0a00 04f2 006f 8820 994a e052 17f2 3d90  .....o...J.R..=.
	0x0020:  8011 00fb 19c7 0000 0101 080a f51d 1b3f  ...............?
	0x0030:  76ce 6166                                v.af
16:23:57.419186 IP (tos 0x0, ttl 64, id 852, offset 0, flags [DF], proto TCP (6), length 60)
    10.0.4.242.37942 > 10.0.0.175.2049: Flags [S], cksum 0x3a41 (correct), seq 2287860264, win 64860, options [mss 1410,sackOK,TS val 1993236838 ecr 0,nop,wscale 8], length 0
	0x0000:  4500 003c 0354 4000 4006 1dc8 0a00 04f2  E..<.T@.@.......
	0x0010:  0a00 00af 9436 0801 885d fa28 0000 0000  .....6...].(....
	0x0020:  a002 fd5c 3a41 0000 0204 0582 0402 080a  ...\:A..........
	0x0030:  76ce 6166 0000 0000 0103 0308            v.af........
16:23:57.419209 IP (tos 0x0, ttl 63, id 852, offset 0, flags [DF], proto TCP (6), length 60)
    10.0.4.242.37942 > 10.0.0.175.2049: Flags [S], cksum 0x3a41 (correct), seq 2287860264, win 64860, options [mss 1410,sackOK,TS val 1993236838 ecr 0,nop,wscale 8], length 0
	0x0000:  4500 003c 0354 4000 3f06 1ec8 0a00 04f2  E..<.T@.?.......
	0x0010:  0a00 00af 9436 0801 885d fa28 0000 0000  .....6...].(....
	0x0020:  a002 fd5c 3a41 0000 0204 0582 0402 080a  ...\:A..........
	0x0030:  76ce 6166 0000 0000 0103 0308            v.af........
16:23:57.419222 IP (tos 0x0, ttl 64, id 0, offset 0, flags [DF], proto TCP (6), length 60)
    10.0.0.175.2049 > 10.0.4.242.37942: Flags [S.], cksum 0x19cf (incorrect -> 0xcc91), seq 2451098960, ack 2287860265, win 64308, options [mss 1410,sackOK,TS val 4112325439 ecr 1993236838,nop,wscale 8], length 0
	0x0000:  4500 003c 0000 4000 4006 211c 0a00 00af  E..<..@.@.!.....
	0x0010:  0a00 04f2 0801 9436 9218 cd50 885d fa29  .......6...P.].)
	0x0020:  a012 fb34 19cf 0000 0204 0582 0402 080a  ...4............
	0x0030:  f51d 1b3f 76ce 6166 0103 0308            ...?v.af....
16:23:57.419231 IP (tos 0x0, ttl 64, id 0, offset 0, flags [DF], proto TCP (6), length 60)
    10.0.0.175.2049 > 10.0.4.242.37942: Flags [S.], cksum 0x19cf (incorrect -> 0xcc91), seq 2451098960, ack 2287860265, win 64308, options [mss 1410,sackOK,TS val 4112325439 ecr 1993236838,nop,wscale 8], length 0
	0x0000:  4500 003c 0000 4000 4006 211c 0a00 00af  E..<..@.@.!.....
	0x0010:  0a00 04f2 0801 9436 9218 cd50 885d fa29  .......6...P.].)
	0x0020:  a012 fb34 19cf 0000 0204 0582 0402 080a  ...4............
	0x0030:  f51d 1b3f 76ce 6166 0103 0308            ...?v.af....
16:23:57.419366 IP (tos 0x0, ttl 64, id 52669, offset 0, flags [DF], proto TCP (6), length 52)
    10.0.4.242.34848 > 10.0.0.175.111: Flags [.], cksum 0x1bdc (correct), seq 62, ack 34, win 254, options [nop,nop,TS val 1993236839 ecr 4112325439], length 0
	0x0000:  4500 0034 cdbd 4000 4006 5366 0a00 04f2  E..4..@.@.Sf....
	0x0010:  0a00 00af 8820 006f 17f2 3d90 994a e053  .......o..=..J.S
	0x0020:  8010 00fe 1bdc 0000 0101 080a 76ce 6167  ............v.ag
	0x0030:  f51d 1b3f                                ...?
16:23:57.419385 IP (tos 0x0, ttl 63, id 52669, offset 0, flags [DF], proto TCP (6), length 52)
    10.0.4.242.34848 > 10.0.0.175.111: Flags [.], cksum 0x1bdc (correct), seq 62, ack 34, win 254, options [nop,nop,TS val 1993236839 ecr 4112325439], length 0
	0x0000:  4500 0034 cdbd 4000 3f06 5466 0a00 04f2  E..4..@.?.Tf....
	0x0010:  0a00 00af 8820 006f 17f2 3d90 994a e053  .......o..=..J.S
	0x0020:  8010 00fe 1bdc 0000 0101 080a 76ce 6167  ............v.ag
	0x0030:  f51d 1b3f                                ...?
16:23:57.419568 IP (tos 0x0, ttl 64, id 853, offset 0, flags [DF], proto TCP (6), length 52)
    10.0.4.242.37942 > 10.0.0.175.2049: Flags [.], cksum 0xf562 (correct), seq 1, ack 1, win 254, options [nop,nop,TS val 1993236839 ecr 4112325439], length 0
	0x0000:  4500 0034 0355 4000 4006 1dcf 0a00 04f2  E..4.U@.@.......
	0x0010:  0a00 00af 9436 0801 885d fa29 9218 cd51  .....6...].)...Q
	0x0020:  8010 00fe f562 0000 0101 080a 76ce 6167  .....b......v.ag
	0x0030:  f51d 1b3f                                ...?
16:23:57.419582 IP (tos 0x0, ttl 63, id 853, offset 0, flags [DF], proto TCP (6), length 52)
    10.0.4.242.37942 > 10.0.0.175.2049: Flags [.], cksum 0xf562 (correct), seq 1, ack 1, win 254, options [nop,nop,TS val 1993236839 ecr 4112325439], length 0
	0x0000:  4500 0034 0355 4000 3f06 1ecf 0a00 04f2  E..4.U@.?.......
	0x0010:  0a00 00af 9436 0801 885d fa29 9218 cd51  .....6...].)...Q
	0x0020:  8010 00fe f562 0000 0101 080a 76ce 6167  .....b......v.ag
	0x0030:  f51d 1b3f                                ...?
16:23:57.419677 IP (tos 0x0, ttl 64, id 854, offset 0, flags [DF], proto TCP (6), length 96)
    10.0.4.242.37942 > 10.0.0.175.2049: Flags [P.], cksum 0xaa62 (correct), seq 1:45, ack 1, win 254, options [nop,nop,TS val 1993236839 ecr 4112325439], length 44: NFS request xid 4034941817 40 null
	0x0000:  4500 0060 0356 4000 4006 1da2 0a00 04f2  E..`.V@.@.......
	0x0010:  0a00 00af 9436 0801 885d fa29 9218 cd51  .....6...].)...Q
	0x0020:  8018 00fe aa62 0000 0101 080a 76ce 6167  .....b......v.ag
	0x0030:  f51d 1b3f 8000 0028 f080 5379 0000 0000  ...?...(..Sy....
	0x0040:  0000 0002 0001 86a3 0000 0003 0000 0000  ................
	0x0050:  0000 0000 0000 0000 0000 0000 0000 0000  ................
16:23:57.419693 IP (tos 0x0, ttl 63, id 854, offset 0, flags [DF], proto TCP (6), length 96)
    10.0.4.242.37942 > 10.0.0.175.2049: Flags [P.], cksum 0xaa62 (correct), seq 1:45, ack 1, win 254, options [nop,nop,TS val 1993236839 ecr 4112325439], length 44: NFS request xid 4034941817 40 null
	0x0000:  4500 0060 0356 4000 3f06 1ea2 0a00 04f2  E..`.V@.?.......
	0x0010:  0a00 00af 9436 0801 885d fa29 9218 cd51  .....6...].)...Q
	0x0020:  8018 00fe aa62 0000 0101 080a 76ce 6167  .....b......v.ag
	0x0030:  f51d 1b3f 8000 0028 f080 5379 0000 0000  ...?...(..Sy....
	0x0040:  0000 0002 0001 86a3 0000 0003 0000 0000  ................
	0x0050:  0000 0000 0000 0000 0000 0000 0000 0000  ................
16:23:57.419701 IP (tos 0x0, ttl 64, id 43477, offset 0, flags [DF], proto TCP (6), length 52)
    10.0.0.175.2049 > 10.0.4.242.37942: Flags [.], cksum 0x19c7 (incorrect -> 0xf538), seq 1, ack 45, win 252, options [nop,nop,TS val 4112325439 ecr 1993236839], length 0
	0x0000:  4500 0034 a9d5 4000 4006 774e 0a00 00af  E..4..@.@.wN....
	0x0010:  0a00 04f2 0801 9436 9218 cd51 885d fa55  .......6...Q.].U
	0x0020:  8010 00fc 19c7 0000 0101 080a f51d 1b3f  ...............?
	0x0030:  76ce 6167                                v.ag
16:23:57.419704 IP (tos 0x0, ttl 64, id 43477, offset 0, flags [DF], proto TCP (6), length 52)
    10.0.0.175.2049 > 10.0.4.242.37942: Flags [.], cksum 0x19c7 (incorrect -> 0xf538), seq 1, ack 45, win 252, options [nop,nop,TS val 4112325439 ecr 1993236839], length 0
	0x0000:  4500 0034 a9d5 4000 4006 774e 0a00 00af  E..4..@.@.wN....
	0x0010:  0a00 04f2 0801 9436 9218 cd51 885d fa55  .......6...Q.].U
	0x0020:  8010 00fc 19c7 0000 0101 080a f51d 1b3f  ...............?
	0x0030:  76ce 6167                                v.ag
16:23:57.419983 IP (tos 0x0, ttl 64, id 43478, offset 0, flags [DF], proto TCP (6), length 80)
    10.0.0.175.2049 > 10.0.4.242.37942: Flags [P.], cksum 0x19e3 (incorrect -> 0x3101), seq 1:29, ack 45, win 252, options [nop,nop,TS val 4112325439 ecr 1993236839], length 28: NFS reply xid 4034941817 reply ok 24 null
	0x0000:  4500 0050 a9d6 4000 4006 7731 0a00 00af  E..P..@.@.w1....
	0x0010:  0a00 04f2 0801 9436 9218 cd51 885d fa55  .......6...Q.].U
	0x0020:  8018 00fc 19e3 0000 0101 080a f51d 1b3f  ...............?
	0x0030:  76ce 6167 8000 0018 f080 5379 0000 0001  v.ag......Sy....
	0x0040:  0000 0000 0000 0000 0000 0000 0000 0000  ................
16:23:57.420002 IP (tos 0x0, ttl 64, id 43478, offset 0, flags [DF], proto TCP (6), length 80)
    10.0.0.175.2049 > 10.0.4.242.37942: Flags [P.], cksum 0x19e3 (incorrect -> 0x3101), seq 1:29, ack 45, win 252, options [nop,nop,TS val 4112325439 ecr 1993236839], length 28: NFS reply xid 4034941817 reply ok 24 null
	0x0000:  4500 0050 a9d6 4000 4006 7731 0a00 00af  E..P..@.@.w1....
	0x0010:  0a00 04f2 0801 9436 9218 cd51 885d fa55  .......6...Q.].U
	0x0020:  8018 00fc 19e3 0000 0101 080a f51d 1b3f  ...............?
	0x0030:  76ce 6167 8000 0018 f080 5379 0000 0001  v.ag......Sy....
	0x0040:  0000 0000 0000 0000 0000 0000 0000 0000  ................
16:23:57.420264 IP (tos 0x0, ttl 64, id 855, offset 0, flags [DF], proto TCP (6), length 52)
    10.0.4.242.37942 > 10.0.0.175.2049: Flags [.], cksum 0xf519 (correct), seq 45, ack 29, win 254, options [nop,nop,TS val 1993236840 ecr 4112325439], length 0
	0x0000:  4500 0034 0357 4000 4006 1dcd 0a00 04f2  E..4.W@.@.......
	0x0010:  0a00 00af 9436 0801 885d fa55 9218 cd6d  .....6...].U...m
	0x0020:  8010 00fe f519 0000 0101 080a 76ce 6168  ............v.ah
	0x0030:  f51d 1b3f                                ...?
16:23:57.420297 IP (tos 0x0, ttl 63, id 855, offset 0, flags [DF], proto TCP (6), length 52)
    10.0.4.242.37942 > 10.0.0.175.2049: Flags [.], cksum 0xf519 (correct), seq 45, ack 29, win 254, options [nop,nop,TS val 1993236840 ecr 4112325439], length 0
	0x0000:  4500 0034 0357 4000 3f06 1ecd 0a00 04f2  E..4.W@.?.......
	0x0010:  0a00 00af 9436 0801 885d fa55 9218 cd6d  .....6...].U...m
	0x0020:  8010 00fe f519 0000 0101 080a 76ce 6168  ............v.ah
	0x0030:  f51d 1b3f                                ...?
16:23:57.420332 IP (tos 0x0, ttl 64, id 856, offset 0, flags [DF], proto TCP (6), length 52)
    10.0.4.242.37942 > 10.0.0.175.2049: Flags [F.], cksum 0xf518 (correct), seq 45, ack 29, win 254, options [nop,nop,TS val 1993236840 ecr 4112325439], length 0
	0x0000:  4500 0034 0358 4000 4006 1dcc 0a00 04f2  E..4.X@.@.......
	0x0010:  0a00 00af 9436 0801 885d fa55 9218 cd6d  .....6...].U...m
	0x0020:  8011 00fe f518 0000 0101 080a 76ce 6168  ............v.ah
	0x0030:  f51d 1b3f                                ...?
16:23:57.420350 IP (tos 0x0, ttl 63, id 856, offset 0, flags [DF], proto TCP (6), length 52)
    10.0.4.242.37942 > 10.0.0.175.2049: Flags [F.], cksum 0xf518 (correct), seq 45, ack 29, win 254, options [nop,nop,TS val 1993236840 ecr 4112325439], length 0
	0x0000:  4500 0034 0358 4000 3f06 1ecc 0a00 04f2  E..4.X@.?.......
	0x0010:  0a00 00af 9436 0801 885d fa55 9218 cd6d  .....6...].U...m
	0x0020:  8011 00fe f518 0000 0101 080a 76ce 6168  ............v.ah
	0x0030:  f51d 1b3f                                ...?
16:23:57.420641 IP (tos 0x0, ttl 64, id 43479, offset 0, flags [DF], proto TCP (6), length 52)
    10.0.0.175.2049 > 10.0.4.242.37942: Flags [F.], cksum 0x19c7 (incorrect -> 0xf518), seq 29, ack 46, win 252, options [nop,nop,TS val 4112325440 ecr 1993236840], length 0
	0x0000:  4500 0034 a9d7 4000 4006 774c 0a00 00af  E..4..@.@.wL....
	0x0010:  0a00 04f2 0801 9436 9218 cd6d 885d fa56  .......6...m.].V
	0x0020:  8011 00fc 19c7 0000 0101 080a f51d 1b40  ...............@
	0x0030:  76ce 6168                                v.ah
16:23:57.420669 IP (tos 0x0, ttl 64, id 43479, offset 0, flags [DF], proto TCP (6), length 52)
    10.0.0.175.2049 > 10.0.4.242.37942: Flags [F.], cksum 0x19c7 (incorrect -> 0xf518), seq 29, ack 46, win 252, options [nop,nop,TS val 4112325440 ecr 1993236840], length 0
	0x0000:  4500 0034 a9d7 4000 4006 774c 0a00 00af  E..4..@.@.wL....
	0x0010:  0a00 04f2 0801 9436 9218 cd6d 885d fa56  .......6...m.].V
	0x0020:  8011 00fc 19c7 0000 0101 080a f51d 1b40  ...............@
	0x0030:  76ce 6168                                v.ah
16:23:57.420885 IP (tos 0x0, ttl 64, id 857, offset 0, flags [DF], proto TCP (6), length 52)
    10.0.4.242.37942 > 10.0.0.175.2049: Flags [.], cksum 0xf516 (correct), seq 46, ack 30, win 254, options [nop,nop,TS val 1993236840 ecr 4112325440], length 0
	0x0000:  4500 0034 0359 4000 4006 1dcb 0a00 04f2  E..4.Y@.@.......
	0x0010:  0a00 00af 9436 0801 885d fa56 9218 cd6e  .....6...].V...n
	0x0020:  8010 00fe f516 0000 0101 080a 76ce 6168  ............v.ah
	0x0030:  f51d 1b40                                ...@
16:23:57.420924 IP (tos 0x0, ttl 63, id 857, offset 0, flags [DF], proto TCP (6), length 52)
    10.0.4.242.37942 > 10.0.0.175.2049: Flags [.], cksum 0xf516 (correct), seq 46, ack 30, win 254, options [nop,nop,TS val 1993236840 ecr 4112325440], length 0
	0x0000:  4500 0034 0359 4000 3f06 1ecb 0a00 04f2  E..4.Y@.?.......
	0x0010:  0a00 00af 9436 0801 885d fa56 9218 cd6e  .....6...].V...n
	0x0020:  8010 00fe f516 0000 0101 080a 76ce 6168  ............v.ah
	0x0030:  f51d 1b40                                ...@
16:23:57.420934 IP (tos 0x0, ttl 64, id 33483, offset 0, flags [DF], proto TCP (6), length 60)
    10.0.4.242.833 > 10.0.0.175.20048: Flags [S], cksum 0x1ced (correct), seq 2307154170, win 64860, options [mss 1410,sackOK,TS val 1993236840 ecr 0,nop,wscale 8], length 0
	0x0000:  4500 003c 82cb 4000 4006 9e50 0a00 04f2  E..<..@.@..P....
	0x0010:  0a00 00af 0341 4e50 8984 60fa 0000 0000  .....ANP..`.....
	0x0020:  a002 fd5c 1ced 0000 0204 0582 0402 080a  ...\............
	0x0030:  76ce 6168 0000 0000 0103 0308            v.ah........
16:23:57.420974 IP (tos 0x0, ttl 63, id 33483, offset 0, flags [DF], proto TCP (6), length 60)
    10.0.4.242.833 > 10.0.0.175.20048: Flags [S], cksum 0x1ced (correct), seq 2307154170, win 64860, options [mss 1410,sackOK,TS val 1993236840 ecr 0,nop,wscale 8], length 0
	0x0000:  4500 003c 82cb 4000 3f06 9f50 0a00 04f2  E..<..@.?..P....
	0x0010:  0a00 00af 0341 4e50 8984 60fa 0000 0000  .....ANP..`.....
	0x0020:  a002 fd5c 1ced 0000 0204 0582 0402 080a  ...\............
	0x0030:  76ce 6168 0000 0000 0103 0308            v.ah........
16:23:57.420988 IP (tos 0x0, ttl 64, id 0, offset 0, flags [DF], proto TCP (6), length 60)
    10.0.0.175.20048 > 10.0.4.242.833: Flags [S.], cksum 0x19cf (incorrect -> 0x1c5d), seq 3222286904, ack 2307154171, win 64308, options [mss 1410,sackOK,TS val 4112325440 ecr 1993236840,nop,wscale 8], length 0
	0x0000:  4500 003c 0000 4000 4006 211c 0a00 00af  E..<..@.@.!.....
	0x0010:  0a00 04f2 4e50 0341 c010 3238 8984 60fb  ....NP.A..28..`.
	0x0020:  a012 fb34 19cf 0000 0204 0582 0402 080a  ...4............
	0x0030:  f51d 1b40 76ce 6168 0103 0308            ...@v.ah....
16:23:57.420999 IP (tos 0x0, ttl 64, id 0, offset 0, flags [DF], proto TCP (6), length 60)
    10.0.0.175.20048 > 10.0.4.242.833: Flags [S.], cksum 0x19cf (incorrect -> 0x1c5d), seq 3222286904, ack 2307154171, win 64308, options [mss 1410,sackOK,TS val 4112325440 ecr 1993236840,nop,wscale 8], length 0
	0x0000:  4500 003c 0000 4000 4006 211c 0a00 00af  E..<..@.@.!.....
	0x0010:  0a00 04f2 4e50 0341 c010 3238 8984 60fb  ....NP.A..28..`.
	0x0020:  a012 fb34 19cf 0000 0204 0582 0402 080a  ...4............
	0x0030:  f51d 1b40 76ce 6168 0103 0308            ...@v.ah....
16:23:57.421292 IP (tos 0x0, ttl 64, id 33484, offset 0, flags [DF], proto TCP (6), length 52)
    10.0.4.242.833 > 10.0.0.175.20048: Flags [.], cksum 0x452e (correct), seq 1, ack 1, win 254, options [nop,nop,TS val 1993236841 ecr 4112325440], length 0
	0x0000:  4500 0034 82cc 4000 4006 9e57 0a00 04f2  E..4..@.@..W....
	0x0010:  0a00 00af 0341 4e50 8984 60fb c010 3239  .....ANP..`...29
	0x0020:  8010 00fe 452e 0000 0101 080a 76ce 6169  ....E.......v.ai
	0x0030:  f51d 1b40                                ...@
16:23:57.421312 IP (tos 0x0, ttl 63, id 33484, offset 0, flags [DF], proto TCP (6), length 52)
    10.0.4.242.833 > 10.0.0.175.20048: Flags [.], cksum 0x452e (correct), seq 1, ack 1, win 254, options [nop,nop,TS val 1993236841 ecr 4112325440], length 0
	0x0000:  4500 0034 82cc 4000 3f06 9f57 0a00 04f2  E..4..@.?..W....
	0x0010:  0a00 00af 0341 4e50 8984 60fb c010 3239  .....ANP..`...29
	0x0020:  8010 00fe 452e 0000 0101 080a 76ce 6169  ....E.......v.ai
	0x0030:  f51d 1b40                                ...@
16:23:57.421370 IP (tos 0x0, ttl 64, id 33485, offset 0, flags [DF], proto TCP (6), length 96)
    10.0.4.242.833 > 10.0.0.175.20048: Flags [P.], cksum 0xa0fe (correct), seq 1:45, ack 1, win 254, options [nop,nop,TS val 1993236841 ecr 4112325440], length 44
	0x0000:  4500 0060 82cd 4000 4006 9e2a 0a00 04f2  E..`..@.@..*....
	0x0010:  0a00 00af 0341 4e50 8984 60fb c010 3239  .....ANP..`...29
	0x0020:  8018 00fe a0fe 0000 0101 080a 76ce 6169  ............v.ai
	0x0030:  f51d 1b40 8000 0028 e221 bb05 0000 0000  ...@...(.!......
	0x0040:  0000 0002 0001 86a5 0000 0003 0000 0000  ................
	0x0050:  0000 0000 0000 0000 0000 0000 0000 0000  ................
16:23:57.421385 IP (tos 0x0, ttl 63, id 33485, offset 0, flags [DF], proto TCP (6), length 96)
    10.0.4.242.833 > 10.0.0.175.20048: Flags [P.], cksum 0xa0fe (correct), seq 1:45, ack 1, win 254, options [nop,nop,TS val 1993236841 ecr 4112325440], length 44
	0x0000:  4500 0060 82cd 4000 3f06 9f2a 0a00 04f2  E..`..@.?..*....
	0x0010:  0a00 00af 0341 4e50 8984 60fb c010 3239  .....ANP..`...29
	0x0020:  8018 00fe a0fe 0000 0101 080a 76ce 6169  ............v.ai
	0x0030:  f51d 1b40 8000 0028 e221 bb05 0000 0000  ...@...(.!......
	0x0040:  0000 0002 0001 86a5 0000 0003 0000 0000  ................
	0x0050:  0000 0000 0000 0000 0000 0000 0000 0000  ................
16:23:57.421394 IP (tos 0x0, ttl 64, id 11565, offset 0, flags [DF], proto TCP (6), length 52)
    10.0.0.175.20048 > 10.0.4.242.833: Flags [.], cksum 0x19c7 (incorrect -> 0x4503), seq 1, ack 45, win 252, options [nop,nop,TS val 4112325441 ecr 1993236841], length 0
	0x0000:  4500 0034 2d2d 4000 4006 f3f6 0a00 00af  E..4--@.@.......
	0x0010:  0a00 04f2 4e50 0341 c010 3239 8984 6127  ....NP.A..29..a'
	0x0020:  8010 00fc 19c7 0000 0101 080a f51d 1b41  ...............A
	0x0030:  76ce 6169                                v.ai
16:23:57.421398 IP (tos 0x0, ttl 64, id 11565, offset 0, flags [DF], proto TCP (6), length 52)
    10.0.0.175.20048 > 10.0.4.242.833: Flags [.], cksum 0x19c7 (incorrect -> 0x4503), seq 1, ack 45, win 252, options [nop,nop,TS val 4112325441 ecr 1993236841], length 0
	0x0000:  4500 0034 2d2d 4000 4006 f3f6 0a00 00af  E..4--@.@.......
	0x0010:  0a00 04f2 4e50 0341 c010 3239 8984 6127  ....NP.A..29..a'
	0x0020:  8010 00fc 19c7 0000 0101 080a f51d 1b41  ...............A
	0x0030:  76ce 6169                                v.ai
16:23:57.421618 IP (tos 0x0, ttl 64, id 11566, offset 0, flags [DF], proto TCP (6), length 80)
    10.0.0.175.20048 > 10.0.4.242.833: Flags [P.], cksum 0x19e3 (incorrect -> 0x279e), seq 1:29, ack 45, win 252, options [nop,nop,TS val 4112325441 ecr 1993236841], length 28
	0x0000:  4500 0050 2d2e 4000 4006 f3d9 0a00 00af  E..P-.@.@.......
	0x0010:  0a00 04f2 4e50 0341 c010 3239 8984 6127  ....NP.A..29..a'
	0x0020:  8018 00fc 19e3 0000 0101 080a f51d 1b41  ...............A
	0x0030:  76ce 6169 8000 0018 e221 bb05 0000 0001  v.ai.....!......
	0x0040:  0000 0000 0000 0000 0000 0000 0000 0000  ................
16:23:57.421636 IP (tos 0x0, ttl 64, id 11566, offset 0, flags [DF], proto TCP (6), length 80)
    10.0.0.175.20048 > 10.0.4.242.833: Flags [P.], cksum 0x19e3 (incorrect -> 0x279e), seq 1:29, ack 45, win 252, options [nop,nop,TS val 4112325441 ecr 1993236841], length 28
	0x0000:  4500 0050 2d2e 4000 4006 f3d9 0a00 00af  E..P-.@.@.......
	0x0010:  0a00 04f2 4e50 0341 c010 3239 8984 6127  ....NP.A..29..a'
	0x0020:  8018 00fc 19e3 0000 0101 080a f51d 1b41  ...............A
	0x0030:  76ce 6169 8000 0018 e221 bb05 0000 0001  v.ai.....!......
	0x0040:  0000 0000 0000 0000 0000 0000 0000 0000  ................
16:23:57.421864 IP (tos 0x0, ttl 64, id 33486, offset 0, flags [DF], proto TCP (6), length 52)
    10.0.4.242.833 > 10.0.0.175.20048: Flags [.], cksum 0x44e5 (correct), seq 45, ack 29, win 254, options [nop,nop,TS val 1993236841 ecr 4112325441], length 0
	0x0000:  4500 0034 82ce 4000 4006 9e55 0a00 04f2  E..4..@.@..U....
	0x0010:  0a00 00af 0341 4e50 8984 6127 c010 3255  .....ANP..a'..2U
	0x0020:  8010 00fe 44e5 0000 0101 080a 76ce 6169  ....D.......v.ai
	0x0030:  f51d 1b41                                ...A
16:23:57.421876 IP (tos 0x0, ttl 63, id 33486, offset 0, flags [DF], proto TCP (6), length 52)
    10.0.4.242.833 > 10.0.0.175.20048: Flags [.], cksum 0x44e5 (correct), seq 45, ack 29, win 254, options [nop,nop,TS val 1993236841 ecr 4112325441], length 0
	0x0000:  4500 0034 82ce 4000 3f06 9f55 0a00 04f2  E..4..@.?..U....
	0x0010:  0a00 00af 0341 4e50 8984 6127 c010 3255  .....ANP..a'..2U
	0x0020:  8010 00fe 44e5 0000 0101 080a 76ce 6169  ....D.......v.ai
	0x0030:  f51d 1b41                                ...A
16:23:57.422031 IP (tos 0x0, ttl 64, id 33487, offset 0, flags [DF], proto TCP (6), length 220)
    10.0.4.242.833 > 10.0.0.175.20048: Flags [P.], cksum 0x4fdb (correct), seq 45:213, ack 29, win 254, options [nop,nop,TS val 1993236841 ecr 4112325441], length 168
	0x0000:  4500 00dc 82cf 4000 4006 9dac 0a00 04f2  E.....@.@.......
	0x0010:  0a00 00af 0341 4e50 8984 6127 c010 3255  .....ANP..a'..2U
	0x0020:  8018 00fe 4fdb 0000 0101 080a 76ce 6169  ....O.......v.ai
	0x0030:  f51d 1b41 8000 00a4 e321 bb05 0000 0000  ...A.....!......
	0x0040:  0000 0002 0001 86a5 0000 0003 0000 0001  ................
	0x0050:  0000 0001 0000 0048 0000 0000 0000 002d  .......H.......-
	0x0060:  766d 392d 6e6f 6465 322e 3233 2d31 3036  vm9-node2.23-106
	0x0070:  2d36 312d 3139 332e 6c6f 6e2d 3031 2e75  -61-193.lon-01.u
	0x0080:  6b2e 6170 7073 6f6c 6f2e 636f 6d00 0000  k.appsolo.com...
	0x0090:  0000 0000 0000 0000 0000 0001 0000 0000  ................
	0x00a0:  0000 0000 0000 0000 0000 0030 2f65 7870  ...........0/exp
	0x00b0:  6f72 742f 7076 632d 6630 6432 3166 3163  ort/pvc-f0d21f1c
	0x00c0:  2d30 3166 392d 3432 6534 2d39 3634 622d  -01f9-42e4-964b-
	0x00d0:  3235 3737 6361 3363 6636 3863            2577ca3cf68c
16:23:57.422039 IP (tos 0x0, ttl 63, id 33487, offset 0, flags [DF], proto TCP (6), length 220)
    10.0.4.242.833 > 10.0.0.175.20048: Flags [P.], cksum 0x4fdb (correct), seq 45:213, ack 29, win 254, options [nop,nop,TS val 1993236841 ecr 4112325441], length 168
	0x0000:  4500 00dc 82cf 4000 3f06 9eac 0a00 04f2  E.....@.?.......
	0x0010:  0a00 00af 0341 4e50 8984 6127 c010 3255  .....ANP..a'..2U
	0x0020:  8018 00fe 4fdb 0000 0101 080a 76ce 6169  ....O.......v.ai
	0x0030:  f51d 1b41 8000 00a4 e321 bb05 0000 0000  ...A.....!......
	0x0040:  0000 0002 0001 86a5 0000 0003 0000 0001  ................
	0x0050:  0000 0001 0000 0048 0000 0000 0000 002d  .......H.......-
	0x0060:  766d 392d 6e6f 6465 322e 3233 2d31 3036  vm9-node2.23-106
	0x0070:  2d36 312d 3139 332e 6c6f 6e2d 3031 2e75  -61-193.lon-01.u
	0x0080:  6b2e 6170 7073 6f6c 6f2e 636f 6d00 0000  k.appsolo.com...
	0x0090:  0000 0000 0000 0000 0000 0001 0000 0000  ................
	0x00a0:  0000 0000 0000 0000 0000 0030 2f65 7870  ...........0/exp
	0x00b0:  6f72 742f 7076 632d 6630 6432 3166 3163  ort/pvc-f0d21f1c
	0x00c0:  2d30 3166 392d 3432 6534 2d39 3634 622d  -01f9-42e4-964b-
	0x00d0:  3235 3737 6361 3363 6636 3863            2577ca3cf68c
16:23:57.422045 IP (tos 0x0, ttl 64, id 11567, offset 0, flags [DF], proto TCP (6), length 52)
    10.0.0.175.20048 > 10.0.4.242.833: Flags [.], cksum 0x19c7 (incorrect -> 0x443e), seq 29, ack 213, win 252, options [nop,nop,TS val 4112325442 ecr 1993236841], length 0
	0x0000:  4500 0034 2d2f 4000 4006 f3f4 0a00 00af  E..4-/@.@.......
	0x0010:  0a00 04f2 4e50 0341 c010 3255 8984 61cf  ....NP.A..2U..a.
	0x0020:  8010 00fc 19c7 0000 0101 080a f51d 1b42  ...............B
	0x0030:  76ce 6169                                v.ai
16:23:57.422051 IP (tos 0x0, ttl 64, id 11567, offset 0, flags [DF], proto TCP (6), length 52)
    10.0.0.175.20048 > 10.0.4.242.833: Flags [.], cksum 0x19c7 (incorrect -> 0x443e), seq 29, ack 213, win 252, options [nop,nop,TS val 4112325442 ecr 1993236841], length 0
	0x0000:  4500 0034 2d2f 4000 4006 f3f4 0a00 00af  E..4-/@.@.......
	0x0010:  0a00 04f2 4e50 0341 c010 3255 8984 61cf  ....NP.A..2U..a.
	0x0020:  8010 00fc 19c7 0000 0101 080a f51d 1b42  ...............B
	0x0030:  76ce 6169                                v.ai
16:23:57.422196 IP (tos 0x0, ttl 64, id 11568, offset 0, flags [DF], proto TCP (6), length 124)
    10.0.0.175.20048 > 10.0.4.242.833: Flags [P.], cksum 0x1a0f (incorrect -> 0xe4bd), seq 29:101, ack 213, win 252, options [nop,nop,TS val 4112325442 ecr 1993236841], length 72
	0x0000:  4500 007c 2d30 4000 4006 f3ab 0a00 00af  E..|-0@.@.......
	0x0010:  0a00 04f2 4e50 0341 c010 3255 8984 61cf  ....NP.A..2U..a.
	0x0020:  8018 00fc 1a0f 0000 0101 080a f51d 1b42  ...............B
	0x0030:  76ce 6169 8000 0044 e321 bb05 0000 0001  v.ai...D.!......
	0x0040:  0000 0000 0000 0000 0000 0000 0000 0000  ................
	0x0050:  0000 0000 0000 001c 4300 0001 1644 e993  ........C....D..
	0x0060:  3000 0000 0000 8187 0000 0000 0000 0011  0...............
	0x0070:  4033 0c00 0000 0001 0000 0001            @3..........
16:23:57.422219 IP (tos 0x0, ttl 64, id 11568, offset 0, flags [DF], proto TCP (6), length 124)
    10.0.0.175.20048 > 10.0.4.242.833: Flags [P.], cksum 0x1a0f (incorrect -> 0xe4bd), seq 29:101, ack 213, win 252, options [nop,nop,TS val 4112325442 ecr 1993236841], length 72
	0x0000:  4500 007c 2d30 4000 4006 f3ab 0a00 00af  E..|-0@.@.......
	0x0010:  0a00 04f2 4e50 0341 c010 3255 8984 61cf  ....NP.A..2U..a.
	0x0020:  8018 00fc 1a0f 0000 0101 080a f51d 1b42  ...............B
	0x0030:  76ce 6169 8000 0044 e321 bb05 0000 0001  v.ai...D.!......
	0x0040:  0000 0000 0000 0000 0000 0000 0000 0000  ................
	0x0050:  0000 0000 0000 001c 4300 0001 1644 e993  ........C....D..
	0x0060:  3000 0000 0000 8187 0000 0000 0000 0011  0...............
	0x0070:  4033 0c00 0000 0001 0000 0001            @3..........
16:23:57.422489 IP (tos 0x0, ttl 64, id 33488, offset 0, flags [DF], proto TCP (6), length 52)
    10.0.4.242.833 > 10.0.0.175.20048: Flags [.], cksum 0x43f3 (correct), seq 213, ack 101, win 254, options [nop,nop,TS val 1993236842 ecr 4112325442], length 0
	0x0000:  4500 0034 82d0 4000 4006 9e53 0a00 04f2  E..4..@.@..S....
	0x0010:  0a00 00af 0341 4e50 8984 61cf c010 329d  .....ANP..a...2.
	0x0020:  8010 00fe 43f3 0000 0101 080a 76ce 616a  ....C.......v.aj
	0x0030:  f51d 1b42                                ...B
16:23:57.422501 IP (tos 0x0, ttl 63, id 33488, offset 0, flags [DF], proto TCP (6), length 52)
    10.0.4.242.833 > 10.0.0.175.20048: Flags [.], cksum 0x43f3 (correct), seq 213, ack 101, win 254, options [nop,nop,TS val 1993236842 ecr 4112325442], length 0
	0x0000:  4500 0034 82d0 4000 3f06 9f53 0a00 04f2  E..4..@.?..S....
	0x0010:  0a00 00af 0341 4e50 8984 61cf c010 329d  .....ANP..a...2.
	0x0020:  8010 00fe 43f3 0000 0101 080a 76ce 616a  ....C.......v.aj
	0x0030:  f51d 1b42                                ...B
16:23:57.422659 IP (tos 0x0, ttl 64, id 33489, offset 0, flags [DF], proto TCP (6), length 52)
    10.0.4.242.833 > 10.0.0.175.20048: Flags [F.], cksum 0x43f2 (correct), seq 213, ack 101, win 254, options [nop,nop,TS val 1993236842 ecr 4112325442], length 0
	0x0000:  4500 0034 82d1 4000 4006 9e52 0a00 04f2  E..4..@.@..R....
	0x0010:  0a00 00af 0341 4e50 8984 61cf c010 329d  .....ANP..a...2.
	0x0020:  8011 00fe 43f2 0000 0101 080a 76ce 616a  ....C.......v.aj
	0x0030:  f51d 1b42                                ...B
16:23:57.422673 IP (tos 0x0, ttl 63, id 33489, offset 0, flags [DF], proto TCP (6), length 52)
    10.0.4.242.833 > 10.0.0.175.20048: Flags [F.], cksum 0x43f2 (correct), seq 213, ack 101, win 254, options [nop,nop,TS val 1993236842 ecr 4112325442], length 0
	0x0000:  4500 0034 82d1 4000 3f06 9f52 0a00 04f2  E..4..@.?..R....
	0x0010:  0a00 00af 0341 4e50 8984 61cf c010 329d  .....ANP..a...2.
	0x0020:  8011 00fe 43f2 0000 0101 080a 76ce 616a  ....C.......v.aj
	0x0030:  f51d 1b42                                ...B
16:23:57.422762 IP (tos 0x0, ttl 64, id 11569, offset 0, flags [DF], proto TCP (6), length 52)
    10.0.0.175.20048 > 10.0.4.242.833: Flags [F.], cksum 0x19c7 (incorrect -> 0x43f3), seq 101, ack 214, win 252, options [nop,nop,TS val 4112325442 ecr 1993236842], length 0
	0x0000:  4500 0034 2d31 4000 4006 f3f2 0a00 00af  E..4-1@.@.......
	0x0010:  0a00 04f2 4e50 0341 c010 329d 8984 61d0  ....NP.A..2...a.
	0x0020:  8011 00fc 19c7 0000 0101 080a f51d 1b42  ...............B
	0x0030:  76ce 616a                                v.aj
16:23:57.422776 IP (tos 0x0, ttl 64, id 11569, offset 0, flags [DF], proto TCP (6), length 52)
    10.0.0.175.20048 > 10.0.4.242.833: Flags [F.], cksum 0x19c7 (incorrect -> 0x43f3), seq 101, ack 214, win 252, options [nop,nop,TS val 4112325442 ecr 1993236842], length 0
	0x0000:  4500 0034 2d31 4000 4006 f3f2 0a00 00af  E..4-1@.@.......
	0x0010:  0a00 04f2 4e50 0341 c010 329d 8984 61d0  ....NP.A..2...a.
	0x0020:  8011 00fc 19c7 0000 0101 080a f51d 1b42  ...............B
	0x0030:  76ce 616a                                v.aj
16:23:57.423039 IP (tos 0x0, ttl 64, id 33490, offset 0, flags [DF], proto TCP (6), length 52)
    10.0.4.242.833 > 10.0.0.175.20048: Flags [.], cksum 0x43f1 (correct), seq 214, ack 102, win 254, options [nop,nop,TS val 1993236842 ecr 4112325442], length 0
	0x0000:  4500 0034 82d2 4000 4006 9e51 0a00 04f2  E..4..@.@..Q....
	0x0010:  0a00 00af 0341 4e50 8984 61d0 c010 329e  .....ANP..a...2.
	0x0020:  8010 00fe 43f1 0000 0101 080a 76ce 616a  ....C.......v.aj
	0x0030:  f51d 1b42                                ...B
16:23:57.423055 IP (tos 0x0, ttl 63, id 33490, offset 0, flags [DF], proto TCP (6), length 52)
    10.0.4.242.833 > 10.0.0.175.20048: Flags [.], cksum 0x43f1 (correct), seq 214, ack 102, win 254, options [nop,nop,TS val 1993236842 ecr 4112325442], length 0
	0x0000:  4500 0034 82d2 4000 3f06 9f51 0a00 04f2  E..4..@.?..Q....
	0x0010:  0a00 00af 0341 4e50 8984 61d0 c010 329e  .....ANP..a...2.
	0x0020:  8010 00fe 43f1 0000 0101 080a 76ce 616a  ....C.......v.aj
	0x0030:  f51d 1b42                                ...B
```

Here's a log with FULL_DEBUG when the nfs-ganesha pod is rescheduled and comes up:
https://pastebin.pl/view/raw/8c5c27e0

Here's a log with FULL_DEBUG after the nfs-ganesha pod comes up, and we try a new mount which hangs:
https://pastebin.pl/view/raw/4e1ad890

Weirdly if I try mounting it with another nfs version it mounts fine, even with the same options. Once the initial mount is unmounted, I can then mount sucessfully.

We're currently working on a solution to unmount and remount on failure, but it's not the optimal solution.

Please let me know if you need any further info.

**Comment by ffilz** [comment]
That's a big wall of trace and logs to look at. Can you point to anything in the trace that might lead to the problem?

Any change of pointing to a raw trace file that could be loaded into wireshark for easier viewing, decoding, and filtering?

**Comment by Rid** [comment]
Here's a wireshark friendly dump: https://easyupload.io/i07uyt

Also attached here as a .txt which should be renamed .pcap for import into wireshark:

[tcpdump.txt](https://github.com/nfs-ganesha/nfs-ganesha/files/8873069/tcpdump.txt)
.

**Comment by Rid** [comment]
I can't really see anything in the tcpdump which looks like it would cause an issue, in the file https://pastebin.pl/view/raw/4e1ad890 the request seems to end around the following logs:

```
09/06/2022 17:48:50 : epoch 62a2307a : mattermost-data-nfs-server-provisioner-0 : nfs-ganesha-20[svc_4] complete_request :DISP :F_DBG :After svc_sendreply on socket 20
09/06/2022 17:48:50 : epoch 62a2307a : mattermost-data-nfs-server-provisioner-0 : nfs-ganesha-20[svc_4] nfs_dupreq_rele :DUPREQ :F_DBG :releasing no-cache res 0x7f369681c000
09/06/2022 17:48:50 : epoch 62a2307a : mattermost-data-nfs-server-provisioner-0 : nfs-ganesha-20[svc_4] rpc :TIRPC :F_DBG :xdr_ioq_destroy() xioq 0x7f369aee0f80
09/06/2022 17:48:50 : epoch 62a2307a : mattermost-data-nfs-server-provisioner-0 : nfs-ganesha-20[svc_4] free_nfs_request :DISP :DEBUG :SVC_DECODE on 0x7f369c206700 fd 20 (::ffff:10.0.4.242:711) xid=2830295418 returned XPRT_IDLE
09/06/2022 17:48:50 : epoch 62a2307a : mattermost-data-nfs-server-provisioner-0 : nfs-ganesha-20[svc_4] free_nfs_request :DISP :F_DBG :free_nfs_request: 0x7f369c206700 fd 20 xp_refcnt 3
```

Is this anything out of the ordinary?

**Comment by ffilz** [comment]
So those tcpdumps have a successful NFS v3 MOUNT in them.  I'm not sure why the client then doesn't do anything more.

Perhaps there's something going wrong at the TCP layer?

**Comment by Rid** [comment]
I thought perhaps it was an issue with the kernel nfs client, I've upgraded to Ubuntu 22.04 and kernel 5.15.0-37-generic, however the issue still persists.

I'll have another look at the network logs.

Any more avenues to investigate would be appreciated.

**Comment by Rid** [comment]
@ffilz As the binary is started with the following options:

`ganesha.nfsd -F -L /export/ganesha.log -p /var/run/ganesha.pid -f /export/vfs.conf`

Is there any state saved in `/var/lib/nfs` which would be required for successful reconnection? `/var/lib/nfs` is not included as a persistent volume so any data within is ephemeral.

**Comment by Rid** [comment]
We have narrowed this down to an issue with cilium when using the `kube-proxy-replacement`. It works as expected without `kube-proxy-replacement`. https://github.com/cilium/cilium/issues/21541

I will close this as updates will be in the above issue.
