### ISSUE TITLE
Failed to get attrs for referral

### ISSUE THREAD

**Issue by runningman84** [nfs-ganesha/nfs-ganesha#575]
I am running a lcx container in proxmox using ubuntu 20.04. This is my ganesha config:
```
$ cat /etc/ganesha/ganesha.con
EXPORT_DEFAULTS {
        Access_Type = RW;

        CLIENT
        {
                Clients = 10.0.20.0/24, 10.0.30.0/24;
        }
}

EXPORT
{
        Export_Id = 11;
        Path = /storage/share/public;
        Pseudo = /storage/share/public;
        Access_Type = RW;
        FSAL {
                Name = VFS;
        }
}

$ ganesha.nfsd -v 
NFS-Ganesha Release = V3.0.3
```

The path /storage/share/public is a moint point bind mounted by a zfs volume of the proxmos host:
```
$ ls -la /storage/share/public
total 37
drwxrwxr-x  6 phil   users      7 May  2 21:18 .
drwxr-xr-x  5 root   root    4096 Apr 21 20:29 ..
drwxrwxrwx 68 phil   users    100 May 16  2016 Musik
drwxr-xr-x 32 phil   users     36 Mar 14 21:01 Video
drwxrwxr-x  2 phil      1000    6 Mar 14 21:01 ct
drwxr-xr-x  4 plex   users      4 May  2 21:18 plex
-rw-r--r--  1 nobody nogroup    0 Apr 21 20:24 public.txt

$ df
Filesystem                        1K-blocks      Used  Available Use% Mounted on
/dev/mapper/pve-vm--103--disk--0   16382844   1449272   14078328  10% /
storage/share/public             1680907904 382234624 1298673280  23% /storage/share/public
storage/share/private            1503102464 204429184 1298673280  14% /storage/share/private
storage/share/backup             1298673408       128 1298673280   1% /storage/share/backup
none                                    492         0        492   0% /dev
udev                                3951936         0    3951936   0% /dev/tty
tmpfs                               3976528         0    3976528   0% /dev/shm
tmpfs                                795308      1596     793712   1% /run
tmpfs                                  5120         0       5120   0% /run/lock
tmpfs                               3976528         0    3976528   0% /sys/fs/cgroup
tmpfs                                795304         0     795304   0% /run/user/0
```

My server log looks like this:
```
root@nas:/var/log/ganesha# tail -f ganesha.log 
03/05/2020 18:36:25 : epoch 5eaf0f29 : nas : ganesha.nfsd-1476[main] nfs_Start_threads :THREAD :EVENT :General fridge was started successfully
03/05/2020 18:36:25 : epoch 5eaf0f29 : nas : ganesha.nfsd-1476[main] nfs_start :NFS STARTUP :EVENT :-------------------------------------------------
03/05/2020 18:36:25 : epoch 5eaf0f29 : nas : ganesha.nfsd-1476[main] nfs_start :NFS STARTUP :EVENT :             NFS SERVER INITIALIZED
03/05/2020 18:36:25 : epoch 5eaf0f29 : nas : ganesha.nfsd-1476[main] nfs_start :NFS STARTUP :EVENT :-------------------------------------------------
03/05/2020 18:36:25 : epoch 5eaf0f29 : nas : ganesha.nfsd-1476[_9p_disp] _9p_dispatcher_thread :9P DISP :EVENT :9P dispatcher started
03/05/2020 18:36:29 : epoch 5eaf0f29 : nas : ganesha.nfsd-1476[svc_39] fsal_common_is_referral :FSAL :EVENT :Failed to get attrs for referral, handle: 0x55a2941498a0, valid_mask: 0, request_mask: 11dfce, supported: 0, error: Forbidden action
03/05/2020 18:36:29 : epoch 5eaf0f29 : nas : ganesha.nfsd-1476[svc_39] fsal_common_is_referral :FSAL :EVENT :Failed to get attrs for referral, handle: 0x55a2941498a0, valid_mask: 0, request_mask: 11dfce, supported: 0, error: Forbidden action
03/05/2020 18:36:53 : epoch 5eaf0f29 : nas : ganesha.nfsd-1476[svc_54] fsal_common_is_referral :FSAL :EVENT :Failed to get attrs for referral, handle: 0x55a2941498a0, valid_mask: 0, request_mask: 11dfce, supported: 0, error: Forbidden action
03/05/2020 18:36:53 : epoch 5eaf0f29 : nas : ganesha.nfsd-1476[svc_54] fsal_common_is_referral :FSAL :EVENT :Failed to get attrs for referral, handle: 0x55a2941498a0, valid_mask: 0, request_mask: 11dfce, supported: 0, error: Forbidden action
03/05/2020 18:37:55 : epoch 5eaf0f29 : nas : ganesha.nfsd-1476[reaper] nfs_lift_grace_locked :STATE :EVENT :NFS Server Now NOT IN GRACE
03/05/2020 18:39:11 : epoch 5eaf0f29 : nas : ganesha.nfsd-1476[svc_36] fsal_common_is_referral :FSAL :EVENT :Failed to get attrs for referral, handle: 0x55a2941498a0, valid_mask: 0, request_mask: 11dfce, supported: 0, error: Forbidden action
03/05/2020 18:39:11 : epoch 5eaf0f29 : nas : ganesha.nfsd-1476[svc_36] fsal_common_is_referral :FSAL :EVENT :Failed to get attrs for referral, handle: 0x55a2941498a0, valid_mask: 0, request_mask: 11dfce, supported: 0, error: Forbidden action

```

Most of the times I am unable to mount anything:
```
root@cubi001:/mnt# mount.nfs4 10.0.20.41:/storage/share/public/plex /mnt/disk1/
mount.nfs4: Operation not permitted
root@cubi001:/mnt# mount.nfs4 10.0.20.41:/storage/share/public /mnt/disk1/
mount.nfs4: Operation not permitted
root@cubi001:/mnt# mount.nfs 10.0.20.41:/storage/share/public /mnt/disk1/
mount.nfs: Operation not permitted
```

I got it mounted once but in this case I got an operation not permitted error if I listed the content of the folder.

Is there something wrong with my config?

**Comment by dang** [comment]
So, the CLIENT block doesn't apply in EXPORT_DEFAULTS, only in individual EXPORT clauses.  That probably is not the source of your problem here.

My guess is it's related to being in a container.  FSAL_VFS needs some CAPs that root typically has but containers typically don't, such as the ability to call open_by_handle_at().  I've never used Proxmox, so I don't know how it handles container privileges; but on normal Docker systems, or on kubernetes, you need to run Ganesha in a privileged container for FSAL_VFS to work.

The other possibility is that the path /storage/share/public is not properly exported into the container, so access to it is being blocked.

**Comment by malahal** [comment]
enable COMPONENT_EXPORT and COMPONENT_NFS_V4 at FULL_DEBUG, provide us the
ganesha.log. That may indicate the source of this issue.

**Comment by runningman84** [comment]
I will enable further debug logs. Yes it is running in an unprivileged container. From my point of view an unprivileged container should run a user space nfs server just fine. If I would need a privileged container I could also use the normal kernel space nfs server...

**Comment by malahal** [comment]
There should be a difference between running in the host (kernel space) vs in a privileged container, I think. I don't know much about container security though.

**Comment by dang** [comment]
The issue is that NFS (the protocol) imposes the notion of handles that can be used to access files at any time, irrespective of names/rename.  This is implemented in Linux with the open_by_handle_at() syscall.  This syscall is privileged, and so needs the CAP_DAC_READ_SEARCH capability.  Non-priviliged containers do not allow this capability, so FSALs that need open_by_handle_at() (FSAL_VFS and FSAL_GPFS) will fail.  Other FSALs, such as FSAL_CEPH or FSAL_GLUSTER, will be fine.

**Comment by runningman84** [comment]
Ok it looks like there are some general problems with nfs servers in unpriviliged containers:
https://forum.proxmox.com/threads/is-it-possible-to-run-a-nfs-server-within-a-lxc.24403/page-2
But I managed to get the normal nfs kernel server up and running with this config:

```
root@proxmox1:/etc/pve/nodes/proxmox1/lxc# cat 104.conf 
arch: amd64
cores: 1
hostname: nfs
memory: 512
mp0: /storage/share/public,mp=/storage/share/public,ro=0
mp1: /storage/share/private,mp=/storage/share/private,ro=0
mp2: /storage/share/backup,mp=/storage/share/backup,ro=0
net0: name=eth0,bridge=vmbr0,gw=10.0.20.1,hwaddr=6A:FE:EB:5E:08:F0,ip=10.0.20.42/24,tag=20,type=veth
ostype: ubuntu
rootfs: local-lvm:vm-104-disk-0,size=8G
swap: 512
lxc.apparmor.profile: unconfined
```

The same profile produces errors with ganesha. These are the corresponding logs:
```
08/05/2020 21:39:17 : epoch 5eb5d185 : nfs : ganesha.nfsd-129[main] main :MAIN :EVENT :ganesha.nfsd Starting: Ganesha Version 3.0.3
08/05/2020 21:39:17 : epoch 5eb5d185 : nfs : ganesha.nfsd-137[main] log_conf_commit :CONFIG :EVENT :Switching to new component log levels
08/05/2020 21:39:17 : epoch 5eb5d185 : nfs : ganesha.nfsd-137[main] nfs_set_param_from_conf :NFS STARTUP :EVENT :Configuration file successfully parsed
08/05/2020 21:39:17 : epoch 5eb5d185 : nfs : ganesha.nfsd-137[main] init_server_pkgs :NFS STARTUP :EVENT :Initializing ID Mapper.
08/05/2020 21:39:17 : epoch 5eb5d185 : nfs : ganesha.nfsd-137[main] init_server_pkgs :NFS STARTUP :EVENT :ID Mapper successfully initialized.
08/05/2020 21:39:17 : epoch 5eb5d185 : nfs : ganesha.nfsd-137[main] nfs_start_grace :STATE :EVENT :NFS Server Now IN GRACE, duration 90
08/05/2020 21:39:17 : epoch 5eb5d185 : nfs : ganesha.nfsd-137[main] export_defaults_display :EXPORT :M_DBG :DEFAULTS Export Defaults (options=03303002/ffffffff root_squash   , ----, 34-, UDP, TCP, ----, No Manage_Gids, -- Deleg, anon_uid=    -2, anon_gid=    -2, expire=      60, none, sys)
08/05/2020 21:39:17 : epoch 5eb5d185 : nfs : ganesha.nfsd-137[main] export_defaults_display :EXPORT :M_DBG :RESULT Export Defaults (options=03303002/ffffffff root_squash   , ----, 34-, UDP, TCP, ----, No Manage_Gids, -- Deleg, anon_uid=    -2, anon_gid=    -2, expire=      60, none, sys)
08/05/2020 21:39:17 : epoch 5eb5d185 : nfs : ganesha.nfsd-137[main] alloc_export :EXPORT :F_DBG :Allocated export 0x55590947acc8
08/05/2020 21:39:17 : epoch 5eb5d185 : nfs : ganesha.nfsd-137[main] export_display :EXPORT :M_DBG :DEFAULTS 0x55590947acc8 Export 1 pseudo ((null)) with path ((null)) and tag ((null)) perms (options=03303002/00000000               ,     ,    ,               ,               ,         ,                ,                ,                )
08/05/2020 21:39:17 : epoch 5eb5d185 : nfs : ganesha.nfsd-137[main] clean_export_paths :EXPORT :F_DBG :Cleaning paths for 11
08/05/2020 21:39:17 : epoch 5eb5d185 : nfs : ganesha.nfsd-137[main] export_commit_common :EXPORT :F_DBG :Processing 0x55590947acc8
08/05/2020 21:39:17 : epoch 5eb5d185 : nfs : ganesha.nfsd-137[main] get_gsh_export_by_pseudo_locked :EXPORT :F_DBG :Searching for export matching pseudo path /storage/share/public
08/05/2020 21:39:17 : epoch 5eb5d185 : nfs : ganesha.nfsd-137[main] get_gsh_export_by_path_locked :EXPORT :F_DBG :Searching for export matching path /storage/share/public
08/05/2020 21:39:17 : epoch 5eb5d185 : nfs : ganesha.nfsd-137[main] insert_gsh_export :EXPORT :F_DBG :get export ref for id 11 /storage/share/public, refcount = 1
08/05/2020 21:39:17 : epoch 5eb5d185 : nfs : ganesha.nfsd-137[main] insert_gsh_export :EXPORT :F_DBG :get export ref for id 11 /storage/share/public, refcount = 2
08/05/2020 21:39:17 : epoch 5eb5d185 : nfs : ganesha.nfsd-137[main] export_commit_common :EXPORT :F_DBG :put export ref for id 11 /storage/share/public, refcount = 1
08/05/2020 21:39:17 : epoch 5eb5d185 : nfs : ganesha.nfsd-137[main] export_display :EXPORT :M_DBG :RESULT 0x55590947acc8 Export 11 pseudo (/storage/share/public) with path (/storage/share/public) and tag ((null)) perms (options=033031e2/000001e0               , RWrw,    ,               ,               ,         ,                ,                ,                )
08/05/2020 21:39:17 : epoch 5eb5d185 : nfs : ganesha.nfsd-137[main] get_gsh_export_by_pseudo_locked :EXPORT :F_DBG :Searching for export matching pseudo path /
08/05/2020 21:39:17 : epoch 5eb5d185 : nfs : ganesha.nfsd-137[main] get_gsh_export_by_pseudo_locked :EXPORT :F_DBG :Comparing / 1 to /storage/share/public 21
08/05/2020 21:39:17 : epoch 5eb5d185 : nfs : ganesha.nfsd-137[main] build_default_root :EXPORT :DEBUG :Allocating Pseudo root export
08/05/2020 21:39:17 : epoch 5eb5d185 : nfs : ganesha.nfsd-137[main] alloc_export :EXPORT :F_DBG :Allocated export 0x555909481e48
08/05/2020 21:39:17 : epoch 5eb5d185 : nfs : ganesha.nfsd-137[main] insert_gsh_export :EXPORT :F_DBG :get export ref for id 0 /, refcount = 1
08/05/2020 21:39:17 : epoch 5eb5d185 : nfs : ganesha.nfsd-137[main] insert_gsh_export :EXPORT :F_DBG :get export ref for id 0 /, refcount = 2
08/05/2020 21:39:17 : epoch 5eb5d185 : nfs : ganesha.nfsd-137[main] build_default_root :EXPORT :F_DBG :put export ref for id 0 /, refcount = 1
08/05/2020 21:39:17 : epoch 5eb5d185 : nfs : ganesha.nfsd-137[main] config_errs_to_log :CONFIG :WARN :Config File (/etc/ganesha/ganesha.conf:29): Unknown parameter (CLIENT)
08/05/2020 21:39:17 : epoch 5eb5d185 : nfs : ganesha.nfsd-137[main] lower_my_caps :NFS STARTUP :EVENT :CAP_SYS_RESOURCE was successfully removed for proper quota management in FSAL
08/05/2020 21:39:17 : epoch 5eb5d185 : nfs : ganesha.nfsd-137[main] lower_my_caps :NFS STARTUP :EVENT :currenty set capabilities are: =ep cap_sys_module,cap_sys_rawio,cap_sys_resource,cap_sys_time,cap_mac_override,cap_mac_admin-ep
08/05/2020 21:39:17 : epoch 5eb5d185 : nfs : ganesha.nfsd-137[main] init_export_root :EXPORT :DEBUG :About to lookup_path for ExportId=11 Path=/storage/share/public
08/05/2020 21:39:17 : epoch 5eb5d185 : nfs : ganesha.nfsd-137[main] init_export_root :EXPORT :DEBUG :Added root obj 0x555909484d08 FSAL MDCACHE for path /storage/share/public on export_id=11
08/05/2020 21:39:17 : epoch 5eb5d185 : nfs : ganesha.nfsd-137[main] init_export_root :EXPORT :DEBUG :About to lookup_path for ExportId=0 Path=/
08/05/2020 21:39:17 : epoch 5eb5d185 : nfs : ganesha.nfsd-137[main] init_export_root :EXPORT :DEBUG :Added root obj 0x555909485478 FSAL MDCACHE for path / on export_id=0
08/05/2020 21:39:18 : epoch 5eb5d185 : nfs : ganesha.nfsd-137[main] pseudo_mount_export :EXPORT :DEBUG :BUILDING PSEUDOFS: Export_Id 11 Path /storage/share/public Pseudo Path /storage/share/public
08/05/2020 21:39:18 : epoch 5eb5d185 : nfs : ganesha.nfsd-137[main] pseudo_mount_export :EXPORT :DEBUG :BUILDING PSEUDOFS: Looking for export for /storage/share
08/05/2020 21:39:18 : epoch 5eb5d185 : nfs : ganesha.nfsd-137[main] get_gsh_export_by_pseudo_locked :EXPORT :F_DBG :Searching for export matching pseudo path /storage/share
08/05/2020 21:39:18 : epoch 5eb5d185 : nfs : ganesha.nfsd-137[main] get_gsh_export_by_pseudo_locked :EXPORT :F_DBG :Comparing /storage/share 14 to /storage/share/public 21
08/05/2020 21:39:18 : epoch 5eb5d185 : nfs : ganesha.nfsd-137[main] get_gsh_export_by_pseudo_locked :EXPORT :F_DBG :Comparing /storage/share 14 to / 1
08/05/2020 21:39:18 : epoch 5eb5d185 : nfs : ganesha.nfsd-137[main] get_gsh_export_by_pseudo_locked :EXPORT :F_DBG :get export ref for id 0 /, refcount = 2
08/05/2020 21:39:18 : epoch 5eb5d185 : nfs : ganesha.nfsd-137[main] pseudo_mount_export :EXPORT :DEBUG :BUILDING PSEUDOFS: Export_Id 11 Path /storage/share/public Pseudo Path /storage/share/public Rest storage/share/public
08/05/2020 21:39:18 : epoch 5eb5d185 : nfs : ganesha.nfsd-137[main] make_pseudofs_node :EXPORT :DEBUG :BUILDING PSEUDOFS: Export_Id 11 Path /storage/share/public Pseudo Path /storage/share/public CREATE storage obj 0x55590c314e38 state 0x55590c3150c0 succeeded
08/05/2020 21:39:18 : epoch 5eb5d185 : nfs : ganesha.nfsd-137[main] make_pseudofs_node :EXPORT :DEBUG :BUILDING PSEUDOFS: Export_Id 11 Path /storage/share/public Pseudo Path /storage/share/public CREATE share obj 0x55590c315858 state 0x55590c315ae0 succeeded
08/05/2020 21:39:18 : epoch 5eb5d185 : nfs : ganesha.nfsd-137[main] make_pseudofs_node :EXPORT :DEBUG :BUILDING PSEUDOFS: Export_Id 11 Path /storage/share/public Pseudo Path /storage/share/public CREATE public obj 0x55590c316278 state 0x55590c316500 succeeded
08/05/2020 21:39:18 : epoch 5eb5d185 : nfs : ganesha.nfsd-137[main] pseudo_mount_export :EXPORT :DEBUG :BUILDING PSEUDOFS: Export_Id 11 Path /storage/share/public Pseudo Path /storage/share/public junction 0x55590947acc8
08/05/2020 21:39:18 : epoch 5eb5d185 : nfs : ganesha.nfsd-137[main] nfs_Init_svc :DISP :CRIT :Cannot acquire credentials for principal nfs
08/05/2020 21:39:18 : epoch 5eb5d185 : nfs : ganesha.nfsd-137[main] nfs_Init_admin_thread :NFS CB :EVENT :Admin thread initialized
08/05/2020 21:39:18 : epoch 5eb5d185 : nfs : ganesha.nfsd-137[main] nfs_rpc_cb_init_ccache :NFS STARTUP :WARN :gssd_refresh_krb5_machine_credential failed (-1765328160:22)
08/05/2020 21:39:18 : epoch 5eb5d185 : nfs : ganesha.nfsd-137[main] nfs_Start_threads :THREAD :EVENT :Starting delayed executor.
08/05/2020 21:39:18 : epoch 5eb5d185 : nfs : ganesha.nfsd-137[main] nfs_Start_threads :THREAD :EVENT :9P/TCP dispatcher thread was started successfully
08/05/2020 21:39:18 : epoch 5eb5d185 : nfs : ganesha.nfsd-137[main] nfs_Start_threads :THREAD :EVENT :gsh_dbusthread was started successfully
08/05/2020 21:39:18 : epoch 5eb5d185 : nfs : ganesha.nfsd-137[main] nfs_Start_threads :THREAD :EVENT :admin thread was started successfully
08/05/2020 21:39:18 : epoch 5eb5d185 : nfs : ganesha.nfsd-137[main] nfs_Start_threads :THREAD :EVENT :reaper thread was started successfully
08/05/2020 21:39:18 : epoch 5eb5d185 : nfs : ganesha.nfsd-137[main] nfs_Start_threads :THREAD :EVENT :General fridge was started successfully
08/05/2020 21:39:18 : epoch 5eb5d185 : nfs : ganesha.nfsd-137[_9p_disp] _9p_dispatcher_thread :9P DISP :EVENT :9P dispatcher started
08/05/2020 21:39:18 : epoch 5eb5d185 : nfs : ganesha.nfsd-137[main] nfs_start :NFS STARTUP :EVENT :-------------------------------------------------
08/05/2020 21:39:18 : epoch 5eb5d185 : nfs : ganesha.nfsd-137[main] nfs_start :NFS STARTUP :EVENT :             NFS SERVER INITIALIZED
08/05/2020 21:39:18 : epoch 5eb5d185 : nfs : ganesha.nfsd-137[main] nfs_start :NFS STARTUP :EVENT :-------------------------------------------------
08/05/2020 21:40:48 : epoch 5eb5d185 : nfs : ganesha.nfsd-137[reaper] nfs_lift_grace_locked :STATE :EVENT :NFS Server Now NOT IN GRACE
root@nfs:~# tail -100 /var/log/ganesha/ganesha.log 
08/05/2020 21:41:34 : epoch 5eb5d185 : nfs : ganesha.nfsd-137[svc_98] bitmap4_to_attrmask_t :NFS4 :F_DBG :Request attr 36, name = FATTR4_OWNER
08/05/2020 21:41:34 : epoch 5eb5d185 : nfs : ganesha.nfsd-137[svc_98] bitmap4_to_attrmask_t :NFS4 :F_DBG :Request attr 37, name = FATTR4_OWNER_GROUP
08/05/2020 21:41:34 : epoch 5eb5d185 : nfs : ganesha.nfsd-137[svc_98] bitmap4_to_attrmask_t :NFS4 :F_DBG :Request attr 41, name = FATTR4_RAWDEV
08/05/2020 21:41:34 : epoch 5eb5d185 : nfs : ganesha.nfsd-137[svc_98] bitmap4_to_attrmask_t :NFS4 :F_DBG :Request attr 45, name = FATTR4_SPACE_USED
08/05/2020 21:41:34 : epoch 5eb5d185 : nfs : ganesha.nfsd-137[svc_98] bitmap4_to_attrmask_t :NFS4 :F_DBG :Request attr 47, name = FATTR4_TIME_ACCESS
08/05/2020 21:41:34 : epoch 5eb5d185 : nfs : ganesha.nfsd-137[svc_98] bitmap4_to_attrmask_t :NFS4 :F_DBG :Request attr 52, name = FATTR4_TIME_METADATA
08/05/2020 21:41:34 : epoch 5eb5d185 : nfs : ganesha.nfsd-137[svc_98] bitmap4_to_attrmask_t :NFS4 :F_DBG :Request attr 53, name = FATTR4_TIME_MODIFY
08/05/2020 21:41:34 : epoch 5eb5d185 : nfs : ganesha.nfsd-137[svc_98] bitmap4_to_attrmask_t :NFS4 :F_DBG :Request attr 55, name = FATTR4_MOUNTED_ON_FILEID
08/05/2020 21:41:34 : epoch 5eb5d185 : nfs : ganesha.nfsd-137[svc_98] fsal_common_is_referral :FSAL :EVENT :Failed to get attrs for referral, handle: 0x555909484b70, valid_mask: 0, request_mask: 11dfce, supported: 0, error: Forbidden action
08/05/2020 21:41:34 : epoch 5eb5d185 : nfs : ganesha.nfsd-137[svc_98] complete_op :NFS4 :F_DBG :Current FH  Len=27 0x50380080fe7e000000000000000000000000000000000000000000
08/05/2020 21:41:34 : epoch 5eb5d185 : nfs : ganesha.nfsd-137[svc_98] complete_op :NFS4 :F_DBG :Saved FH    Len=0 (EMPTY)
08/05/2020 21:41:34 : epoch 5eb5d185 : nfs : ganesha.nfsd-137[svc_98] complete_op :NFS4 :DEBUG :Status of OP_GETATTR in position 4 = NFS4ERR_PERM, op response size is 4 total response size is 140
08/05/2020 21:41:34 : epoch 5eb5d185 : nfs : ganesha.nfsd-137[svc_98] complete_nfs4_compound :NFS4 :DEBUG :End status = NFS4ERR_PERM lastindex = 5
08/05/2020 21:41:34 : epoch 5eb5d185 : nfs : ganesha.nfsd-137[svc_98] complete_nfs4_compound :EXPORT :F_DBG :put export ref for id 11 /storage/share/public, refcount = 1
08/05/2020 21:41:34 : epoch 5eb5d185 : nfs : ganesha.nfsd-137[svc_98] release_nfs4_res_compound :NFS4 :F_DBG :Compound Free 0x7efe80001660 (resarraylen=5)
08/05/2020 21:41:34 : epoch 5eb5d185 : nfs : ganesha.nfsd-137[svc_99] export_check_access :EXPORT :M_DBG :EXPORT_DEFAULTS (options=033031e2/000001e0               , RWrw,    ,               ,               ,         ,                ,                ,                )
08/05/2020 21:41:34 : epoch 5eb5d185 : nfs : ganesha.nfsd-137[svc_99] export_check_access :EXPORT :M_DBG :default options (options=03303002/ffffffff root_squash   , ----, 34-, UDP, TCP, ----, No Manage_Gids, -- Deleg, anon_uid=    -2, anon_gid=    -2, expire=      60, none, sys)
08/05/2020 21:41:34 : epoch 5eb5d185 : nfs : ganesha.nfsd-137[svc_99] export_check_access :EXPORT :M_DBG :Final options   (options=033031e2/ffffffff root_squash   , RWrw, 34-, UDP, TCP, ----, No Manage_Gids, -- Deleg, anon_uid=    -2, anon_gid=    -2, expire=      60, none, sys)
08/05/2020 21:41:34 : epoch 5eb5d185 : nfs : ganesha.nfsd-137[svc_99] nfs4_Compound :NFS4 :DEBUG :COMPOUND: There are 1 operations, res = 0x7efe78004320, tag = NO TAG
08/05/2020 21:41:34 : epoch 5eb5d185 : nfs : ganesha.nfsd-137[svc_99] process_one_op :NFS4 :DEBUG :Request 0: opcode 44 is OP_DESTROY_SESSION
08/05/2020 21:41:34 : epoch 5eb5d185 : nfs : ganesha.nfsd-137[svc_99] release_nfs4_res_compound :NFS4 :F_DBG :Compound Free 0x7efe80003af0 (resarraylen=2)
08/05/2020 21:41:34 : epoch 5eb5d185 : nfs : ganesha.nfsd-137[svc_99] complete_op :NFS4 :F_DBG :Current FH  Len=0 (EMPTY)
08/05/2020 21:41:34 : epoch 5eb5d185 : nfs : ganesha.nfsd-137[svc_99] complete_op :NFS4 :F_DBG :Saved FH    Len=0 (EMPTY)
08/05/2020 21:41:34 : epoch 5eb5d185 : nfs : ganesha.nfsd-137[svc_99] complete_op :NFS4 :DEBUG :Status of OP_DESTROY_SESSION in position 0 = NFS4_OK, op response size is 4 total response size is 40
08/05/2020 21:41:34 : epoch 5eb5d185 : nfs : ganesha.nfsd-137[svc_99] release_nfs4_res_compound :NFS4 :F_DBG :Compound Free 0x7efe78004570 (resarraylen=1)
08/05/2020 21:41:34 : epoch 5eb5d185 : nfs : ganesha.nfsd-137[svc_8] export_check_access :EXPORT :M_DBG :EXPORT_DEFAULTS (options=033031e2/000001e0               , RWrw,    ,               ,               ,         ,                ,                ,                )
08/05/2020 21:41:34 : epoch 5eb5d185 : nfs : ganesha.nfsd-137[svc_8] export_check_access :EXPORT :M_DBG :default options (options=03303002/ffffffff root_squash   , ----, 34-, UDP, TCP, ----, No Manage_Gids, -- Deleg, anon_uid=    -2, anon_gid=    -2, expire=      60, none, sys)
08/05/2020 21:41:34 : epoch 5eb5d185 : nfs : ganesha.nfsd-137[svc_8] export_check_access :EXPORT :M_DBG :Final options   (options=033031e2/ffffffff root_squash   , RWrw, 34-, UDP, TCP, ----, No Manage_Gids, -- Deleg, anon_uid=    -2, anon_gid=    -2, expire=      60, none, sys)
08/05/2020 21:41:34 : epoch 5eb5d185 : nfs : ganesha.nfsd-137[svc_8] nfs4_Compound :NFS4 :DEBUG :COMPOUND: There are 1 operations, res = 0x7efe7c001790, tag = NO TAG
08/05/2020 21:41:34 : epoch 5eb5d185 : nfs : ganesha.nfsd-137[svc_8] process_one_op :NFS4 :DEBUG :Request 0: opcode 57 is OP_DESTROY_CLIENTID
08/05/2020 21:41:34 : epoch 5eb5d185 : nfs : ganesha.nfsd-137[svc_8] complete_op :NFS4 :F_DBG :Current FH  Len=0 (EMPTY)
08/05/2020 21:41:34 : epoch 5eb5d185 : nfs : ganesha.nfsd-137[svc_8] complete_op :NFS4 :F_DBG :Saved FH    Len=0 (EMPTY)
08/05/2020 21:41:34 : epoch 5eb5d185 : nfs : ganesha.nfsd-137[svc_8] complete_op :NFS4 :DEBUG :Status of OP_DESTROY_CLIENTID in position 0 = NFS4_OK, op response size is 4 total response size is 40
08/05/2020 21:41:34 : epoch 5eb5d185 : nfs : ganesha.nfsd-137[svc_8] release_nfs4_res_compound :NFS4 :F_DBG :Compound Free 0x7efe7c0019e0 (resarraylen=1)
08/05/2020 21:41:34 : epoch 5eb5d185 : nfs : ganesha.nfsd-137[svc_3] export_check_access :EXPORT :M_DBG :EXPORT_DEFAULTS (options=033031e2/000001e0               , RWrw,    ,               ,               ,         ,                ,                ,                )
08/05/2020 21:41:34 : epoch 5eb5d185 : nfs : ganesha.nfsd-137[svc_3] export_check_access :EXPORT :M_DBG :default options (options=03303002/ffffffff root_squash   , ----, 34-, UDP, TCP, ----, No Manage_Gids, -- Deleg, anon_uid=    -2, anon_gid=    -2, expire=      60, none, sys)
08/05/2020 21:41:34 : epoch 5eb5d185 : nfs : ganesha.nfsd-137[svc_3] export_check_access :EXPORT :M_DBG :Final options   (options=033031e2/ffffffff root_squash   , RWrw, 34-, UDP, TCP, ----, No Manage_Gids, -- Deleg, anon_uid=    -2, anon_gid=    -2, expire=      60, none, sys)
08/05/2020 21:41:34 : epoch 5eb5d185 : nfs : ganesha.nfsd-137[svc_1] export_check_access :EXPORT :M_DBG :EXPORT_DEFAULTS (options=033031e2/000001e0               , RWrw,    ,               ,               ,         ,                ,                ,                )
08/05/2020 21:41:34 : epoch 5eb5d185 : nfs : ganesha.nfsd-137[svc_1] export_check_access :EXPORT :M_DBG :default options (options=03303002/ffffffff root_squash   , ----, 34-, UDP, TCP, ----, No Manage_Gids, -- Deleg, anon_uid=    -2, anon_gid=    -2, expire=      60, none, sys)
08/05/2020 21:41:34 : epoch 5eb5d185 : nfs : ganesha.nfsd-137[svc_1] export_check_access :EXPORT :M_DBG :Final options   (options=033031e2/ffffffff root_squash   , RWrw, 34-, UDP, TCP, ----, No Manage_Gids, -- Deleg, anon_uid=    -2, anon_gid=    -2, expire=      60, none, sys)
08/05/2020 21:41:34 : epoch 5eb5d185 : nfs : ganesha.nfsd-137[svc_98] export_check_access :EXPORT :M_DBG :EXPORT_DEFAULTS (options=033031e2/000001e0               , RWrw,    ,               ,               ,         ,                ,                ,                )
08/05/2020 21:41:34 : epoch 5eb5d185 : nfs : ganesha.nfsd-137[svc_98] export_check_access :EXPORT :M_DBG :default options (options=03303002/ffffffff root_squash   , ----, 34-, UDP, TCP, ----, No Manage_Gids, -- Deleg, anon_uid=    -2, anon_gid=    -2, expire=      60, none, sys)
08/05/2020 21:41:34 : epoch 5eb5d185 : nfs : ganesha.nfsd-137[svc_98] export_check_access :EXPORT :M_DBG :Final options   (options=033031e2/ffffffff root_squash   , RWrw, 34-, UDP, TCP, ----, No Manage_Gids, -- Deleg, anon_uid=    -2, anon_gid=    -2, expire=      60, none, sys)
08/05/2020 21:41:34 : epoch 5eb5d185 : nfs : ganesha.nfsd-137[svc_8] export_check_access :EXPORT :M_DBG :EXPORT_DEFAULTS (options=033031e2/000001e0               , RWrw,    ,               ,               ,         ,                ,                ,                )
08/05/2020 21:41:34 : epoch 5eb5d185 : nfs : ganesha.nfsd-137[svc_8] export_check_access :EXPORT :M_DBG :default options (options=03303002/ffffffff root_squash   , ----, 34-, UDP, TCP, ----, No Manage_Gids, -- Deleg, anon_uid=    -2, anon_gid=    -2, expire=      60, none, sys)
08/05/2020 21:41:34 : epoch 5eb5d185 : nfs : ganesha.nfsd-137[svc_8] export_check_access :EXPORT :M_DBG :Final options   (options=033031e2/ffffffff root_squash   , RWrw, 34-, UDP, TCP, ----, No Manage_Gids, -- Deleg, anon_uid=    -2, anon_gid=    -2, expire=      60, none, sys)
08/05/2020 21:41:34 : epoch 5eb5d185 : nfs : ganesha.nfsd-137[svc_8] get_gsh_export_by_path_locked :EXPORT :F_DBG :Searching for export matching path /storage/share/public
08/05/2020 21:41:34 : epoch 5eb5d185 : nfs : ganesha.nfsd-137[svc_8] get_gsh_export_by_path_locked :EXPORT :F_DBG :get export ref for id 11 /storage/share/public, refcount = 2
08/05/2020 21:41:34 : epoch 5eb5d185 : nfs : ganesha.nfsd-137[svc_8] convert_ipv6_to_ipv4 :EXPORT :M_DBG :Converting IPv6 encapsulated IPv4 address ::ffff:10.0.20.81 to IPv4 10.0.20.81
08/05/2020 21:41:34 : epoch 5eb5d185 : nfs : ganesha.nfsd-137[svc_8] export_check_access :EXPORT :M_DBG :Check for address 10.0.20.81 for export id 11 path /storage/share/public
08/05/2020 21:41:34 : epoch 5eb5d185 : nfs : ganesha.nfsd-137[svc_8] export_check_access :EXPORT :M_DBG :EXPORT          (options=033031e2/000001e0               , RWrw,    ,               ,               ,         ,                ,                ,                )
08/05/2020 21:41:34 : epoch 5eb5d185 : nfs : ganesha.nfsd-137[svc_8] export_check_access :EXPORT :M_DBG :EXPORT_DEFAULTS (options=033031e2/000001e0               , RWrw,    ,               ,               ,         ,                ,                ,                )
08/05/2020 21:41:34 : epoch 5eb5d185 : nfs : ganesha.nfsd-137[svc_8] export_check_access :EXPORT :M_DBG :default options (options=03303002/ffffffff root_squash   , ----, 34-, UDP, TCP, ----, No Manage_Gids, -- Deleg, anon_uid=    -2, anon_gid=    -2, expire=      60, none, sys)
08/05/2020 21:41:34 : epoch 5eb5d185 : nfs : ganesha.nfsd-137[svc_8] export_check_access :EXPORT :M_DBG :Final options   (options=033031e2/ffffffff root_squash   , RWrw, 34-, UDP, TCP, ----, No Manage_Gids, -- Deleg, anon_uid=    -2, anon_gid=    -2, expire=      60, none, sys)
08/05/2020 21:41:34 : epoch 5eb5d185 : nfs : ganesha.nfsd-137[svc_8] mnt_Mnt :EXPORT :F_DBG :put export ref for id 11 /storage/share/public, refcount = 1
08/05/2020 21:41:34 : epoch 5eb5d185 : nfs : ganesha.nfsd-137[svc_96] export_check_access :EXPORT :M_DBG :EXPORT_DEFAULTS (options=033031e2/000001e0               , RWrw,    ,               ,               ,         ,                ,                ,                )
08/05/2020 21:41:34 : epoch 5eb5d185 : nfs : ganesha.nfsd-137[svc_96] export_check_access :EXPORT :M_DBG :default options (options=03303002/ffffffff root_squash   , ----, 34-, UDP, TCP, ----, No Manage_Gids, -- Deleg, anon_uid=    -2, anon_gid=    -2, expire=      60, none, sys)
08/05/2020 21:41:34 : epoch 5eb5d185 : nfs : ganesha.nfsd-137[svc_96] export_check_access :EXPORT :M_DBG :Final options   (options=033031e2/ffffffff root_squash   , RWrw, 34-, UDP, TCP, ----, No Manage_Gids, -- Deleg, anon_uid=    -2, anon_gid=    -2, expire=      60, none, sys)
08/05/2020 21:41:34 : epoch 5eb5d185 : nfs : ganesha.nfsd-137[svc_4] export_check_access :EXPORT :M_DBG :EXPORT_DEFAULTS (options=033031e2/000001e0               , RWrw,    ,               ,               ,         ,                ,                ,                )
08/05/2020 21:41:34 : epoch 5eb5d185 : nfs : ganesha.nfsd-137[svc_4] export_check_access :EXPORT :M_DBG :default options (options=03303002/ffffffff root_squash   , ----, 34-, UDP, TCP, ----, No Manage_Gids, -- Deleg, anon_uid=    -2, anon_gid=    -2, expire=      60, none, sys)
08/05/2020 21:41:34 : epoch 5eb5d185 : nfs : ganesha.nfsd-137[svc_4] export_check_access :EXPORT :M_DBG :Final options   (options=033031e2/ffffffff root_squash   , RWrw, 34-, UDP, TCP, ----, No Manage_Gids, -- Deleg, anon_uid=    -2, anon_gid=    -2, expire=      60, none, sys)
08/05/2020 21:41:34 : epoch 5eb5d185 : nfs : ganesha.nfsd-137[svc_4] get_gsh_export :EXPORT :F_DBG :get export ref for id 11 /storage/share/public, refcount = 2
08/05/2020 21:41:34 : epoch 5eb5d185 : nfs : ganesha.nfsd-137[svc_4] nfs_rpc_process_request :EXPORT :M_DBG :Found export entry for path=/storage/share/public as exportid=11
08/05/2020 21:41:34 : epoch 5eb5d185 : nfs : ganesha.nfsd-137[svc_4] nfs_rpc_process_request :EXPORT :M_DBG :nfs_rpc_process_request about to call nfs_export_check_access for client ::ffff:10.0.20.81
08/05/2020 21:41:34 : epoch 5eb5d185 : nfs : ganesha.nfsd-137[svc_4] convert_ipv6_to_ipv4 :EXPORT :M_DBG :Converting IPv6 encapsulated IPv4 address ::ffff:10.0.20.81 to IPv4 10.0.20.81
08/05/2020 21:41:34 : epoch 5eb5d185 : nfs : ganesha.nfsd-137[svc_4] export_check_access :EXPORT :M_DBG :Check for address 10.0.20.81 for export id 11 path /storage/share/public
08/05/2020 21:41:34 : epoch 5eb5d185 : nfs : ganesha.nfsd-137[svc_4] export_check_access :EXPORT :M_DBG :EXPORT          (options=033031e2/000001e0               , RWrw,    ,               ,               ,         ,                ,                ,                )
08/05/2020 21:41:34 : epoch 5eb5d185 : nfs : ganesha.nfsd-137[svc_4] export_check_access :EXPORT :M_DBG :EXPORT_DEFAULTS (options=033031e2/000001e0               , RWrw,    ,               ,               ,         ,                ,                ,                )
08/05/2020 21:41:34 : epoch 5eb5d185 : nfs : ganesha.nfsd-137[svc_4] export_check_access :EXPORT :M_DBG :default options (options=03303002/ffffffff root_squash   , ----, 34-, UDP, TCP, ----, No Manage_Gids, -- Deleg, anon_uid=    -2, anon_gid=    -2, expire=      60, none, sys)
08/05/2020 21:41:34 : epoch 5eb5d185 : nfs : ganesha.nfsd-137[svc_4] export_check_access :EXPORT :M_DBG :Final options   (options=033031e2/ffffffff root_squash   , RWrw, 34-, UDP, TCP, ----, No Manage_Gids, -- Deleg, anon_uid=    -2, anon_gid=    -2, expire=      60, none, sys)
08/05/2020 21:41:34 : epoch 5eb5d185 : nfs : ganesha.nfsd-137[svc_4] nfs_req_creds :EXPORT :M_DBG :AUTH_SYS creds squashed to uid=4294967294, gid=4294967294
08/05/2020 21:41:34 : epoch 5eb5d185 : nfs : ganesha.nfsd-137[svc_4] free_args :EXPORT :F_DBG :put export ref for id 11 /storage/share/public, refcount = 1
08/05/2020 21:41:34 : epoch 5eb5d185 : nfs : ganesha.nfsd-137[svc_97] export_check_access :EXPORT :M_DBG :EXPORT_DEFAULTS (options=033031e2/000001e0               , RWrw,    ,               ,               ,         ,                ,                ,                )
08/05/2020 21:41:34 : epoch 5eb5d185 : nfs : ganesha.nfsd-137[svc_97] export_check_access :EXPORT :M_DBG :default options (options=03303002/ffffffff root_squash   , ----, 34-, UDP, TCP, ----, No Manage_Gids, -- Deleg, anon_uid=    -2, anon_gid=    -2, expire=      60, none, sys)
08/05/2020 21:41:34 : epoch 5eb5d185 : nfs : ganesha.nfsd-137[svc_97] export_check_access :EXPORT :M_DBG :Final options   (options=033031e2/ffffffff root_squash   , RWrw, 34-, UDP, TCP, ----, No Manage_Gids, -- Deleg, anon_uid=    -2, anon_gid=    -2, expire=      60, none, sys)
08/05/2020 21:41:34 : epoch 5eb5d185 : nfs : ganesha.nfsd-137[svc_97] get_gsh_export :EXPORT :F_DBG :get export ref for id 11 /storage/share/public, refcount = 2
08/05/2020 21:41:34 : epoch 5eb5d185 : nfs : ganesha.nfsd-137[svc_97] nfs_rpc_process_request :EXPORT :M_DBG :Found export entry for path=/storage/share/public as exportid=11
08/05/2020 21:41:34 : epoch 5eb5d185 : nfs : ganesha.nfsd-137[svc_97] nfs_rpc_process_request :EXPORT :M_DBG :nfs_rpc_process_request about to call nfs_export_check_access for client ::ffff:10.0.20.81
08/05/2020 21:41:34 : epoch 5eb5d185 : nfs : ganesha.nfsd-137[svc_97] convert_ipv6_to_ipv4 :EXPORT :M_DBG :Converting IPv6 encapsulated IPv4 address ::ffff:10.0.20.81 to IPv4 10.0.20.81
08/05/2020 21:41:34 : epoch 5eb5d185 : nfs : ganesha.nfsd-137[svc_97] export_check_access :EXPORT :M_DBG :Check for address 10.0.20.81 for export id 11 path /storage/share/public
08/05/2020 21:41:34 : epoch 5eb5d185 : nfs : ganesha.nfsd-137[svc_97] export_check_access :EXPORT :M_DBG :EXPORT          (options=033031e2/000001e0               , RWrw,    ,               ,               ,         ,                ,                ,                )
08/05/2020 21:41:34 : epoch 5eb5d185 : nfs : ganesha.nfsd-137[svc_97] export_check_access :EXPORT :M_DBG :EXPORT_DEFAULTS (options=033031e2/000001e0               , RWrw,    ,               ,               ,         ,                ,                ,                )
08/05/2020 21:41:34 : epoch 5eb5d185 : nfs : ganesha.nfsd-137[svc_97] export_check_access :EXPORT :M_DBG :default options (options=03303002/ffffffff root_squash   , ----, 34-, UDP, TCP, ----, No Manage_Gids, -- Deleg, anon_uid=    -2, anon_gid=    -2, expire=      60, none, sys)
08/05/2020 21:41:34 : epoch 5eb5d185 : nfs : ganesha.nfsd-137[svc_97] export_check_access :EXPORT :M_DBG :Final options   (options=033031e2/ffffffff root_squash   , RWrw, 34-, UDP, TCP, ----, No Manage_Gids, -- Deleg, anon_uid=    -2, anon_gid=    -2, expire=      60, none, sys)
08/05/2020 21:41:34 : epoch 5eb5d185 : nfs : ganesha.nfsd-137[svc_97] nfs_req_creds :EXPORT :M_DBG :AUTH_SYS creds squashed to uid=4294967294, gid=4294967294
08/05/2020 21:41:34 : epoch 5eb5d185 : nfs : ganesha.nfsd-137[svc_97] free_args :EXPORT :F_DBG :put export ref for id 11 /storage/share/public, refcount = 1
08/05/2020 21:41:34 : epoch 5eb5d185 : nfs : ganesha.nfsd-137[svc_1] export_check_access :EXPORT :M_DBG :EXPORT_DEFAULTS (options=033031e2/000001e0               , RWrw,    ,               ,               ,         ,                ,                ,                )
08/05/2020 21:41:34 : epoch 5eb5d185 : nfs : ganesha.nfsd-137[svc_1] export_check_access :EXPORT :M_DBG :default options (options=03303002/ffffffff root_squash   , ----, 34-, UDP, TCP, ----, No Manage_Gids, -- Deleg, anon_uid=    -2, anon_gid=    -2, expire=      60, none, sys)
08/05/2020 21:41:34 : epoch 5eb5d185 : nfs : ganesha.nfsd-137[svc_1] export_check_access :EXPORT :M_DBG :Final options   (options=033031e2/ffffffff root_squash   , RWrw, 34-, UDP, TCP, ----, No Manage_Gids, -- Deleg, anon_uid=    -2, anon_gid=    -2, expire=      60, none, sys)
08/05/2020 21:41:34 : epoch 5eb5d185 : nfs : ganesha.nfsd-137[svc_1] get_gsh_export :EXPORT :F_DBG :get export ref for id 11 /storage/share/public, refcount = 2
08/05/2020 21:41:34 : epoch 5eb5d185 : nfs : ganesha.nfsd-137[svc_1] nfs_rpc_process_request :EXPORT :M_DBG :Found export entry for path=/storage/share/public as exportid=11
08/05/2020 21:41:34 : epoch 5eb5d185 : nfs : ganesha.nfsd-137[svc_1] nfs_rpc_process_request :EXPORT :M_DBG :nfs_rpc_process_request about to call nfs_export_check_access for client ::ffff:10.0.20.81
08/05/2020 21:41:34 : epoch 5eb5d185 : nfs : ganesha.nfsd-137[svc_1] convert_ipv6_to_ipv4 :EXPORT :M_DBG :Converting IPv6 encapsulated IPv4 address ::ffff:10.0.20.81 to IPv4 10.0.20.81
08/05/2020 21:41:34 : epoch 5eb5d185 : nfs : ganesha.nfsd-137[svc_1] export_check_access :EXPORT :M_DBG :Check for address 10.0.20.81 for export id 11 path /storage/share/public
08/05/2020 21:41:34 : epoch 5eb5d185 : nfs : ganesha.nfsd-137[svc_1] export_check_access :EXPORT :M_DBG :EXPORT          (options=033031e2/000001e0               , RWrw,    ,               ,               ,         ,                ,                ,                )
08/05/2020 21:41:34 : epoch 5eb5d185 : nfs : ganesha.nfsd-137[svc_1] export_check_access :EXPORT :M_DBG :EXPORT_DEFAULTS (options=033031e2/000001e0               , RWrw,    ,               ,               ,         ,                ,                ,                )
08/05/2020 21:41:34 : epoch 5eb5d185 : nfs : ganesha.nfsd-137[svc_1] export_check_access :EXPORT :M_DBG :default options (options=03303002/ffffffff root_squash   , ----, 34-, UDP, TCP, ----, No Manage_Gids, -- Deleg, anon_uid=    -2, anon_gid=    -2, expire=      60, none, sys)
08/05/2020 21:41:34 : epoch 5eb5d185 : nfs : ganesha.nfsd-137[svc_1] export_check_access :EXPORT :M_DBG :Final options   (options=033031e2/ffffffff root_squash   , RWrw, 34-, UDP, TCP, ----, No Manage_Gids, -- Deleg, anon_uid=    -2, anon_gid=    -2, expire=      60, none, sys)
08/05/2020 21:41:34 : epoch 5eb5d185 : nfs : ganesha.nfsd-137[svc_1] nfs_req_creds :EXPORT :M_DBG :AUTH_SYS creds squashed to uid=4294967294, gid=4294967294
08/05/2020 21:41:34 : epoch 5eb5d185 : nfs : ganesha.nfsd-137[svc_1] free_args :EXPORT :F_DBG :put export ref for id 11 /storage/share/public, refcount = 1

```

**Comment by ffilz** [comment]
I don't see any actual errors in that log snippet. Is this still an issue?

We have looked at running Ganesha in a container and Ganesha does rely on some bits that don't work well in containers (such as dbus and the open_by_handle_at/name_to_handle_at system calls required by FSAL_VFS). I would not be surprised to find other issues also.

**Comment by ffilz** [comment]
With no action on this in nearly 30 days, I am going to close this as resolved. Please re-open if it is still an issue on a currently supported version of Ganesha.

**Comment by bom-bahadur** [comment]
Hi Team,

Need your advice on this issue:

We have similar setup/issue.
Initially, I can mount these NFS Exports on NFS Client, however after few hours, some mount can not be mounted (/nfs-test/ictadmin: Permission denied: Permission denied)


##
NFS-Ganesha Release = V3.3

## 
Config Snip-it:
## 

EXPORT
{
        Export_Id = 1;
        Path = /ictstr01;
        Pseudo = /ictstr01;
        Protocols = 3,4;
        Access_Type = RW;
        Squash = root_squash;
        FSAL {
                Name = VFS;
        }
}

EXPORT
{
        Export_Id = 2;
        Path = /ictstr01/home;
        Pseudo = /ictstr01/home;
        Protocols = 3,4;
        FSAL {
                Name = VFS;
        }
        CLIENT
        {
                Clients = 146.107.1.224, 146.107.1.225, 10.216.30.11, 10.216.30.12;
                Access_Type = RW;
                Squash = no_root_squash;
        }
        CLIENT
        {
                Clients = 146.107.0.0/24, 10.216.0.0/16;
                Access_Type = RW;
                Squash = root_squash;
        }
}

## Error details:

2021-06-24 23:55:07 : epoch 60d51b5b : nsds01 : ganesha.nfsd-116575[main] nfs_Start_threads :THREAD :EVENT :Starting delayed executor.
2021-06-24 23:55:07 : epoch 60d51b5b : nsds01 : ganesha.nfsd-116575[main] nfs_Start_threads :THREAD :EVENT :gsh_dbusthread was started successfully
2021-06-24 23:55:07 : epoch 60d51b5b : nsds01 : ganesha.nfsd-116575[main] nfs_Start_threads :THREAD :EVENT :admin thread was started successfully
2021-06-24 23:55:07 : epoch 60d51b5b : nsds01 : ganesha.nfsd-116575[main] nfs_Start_threads :THREAD :EVENT :reaper thread was started successfully
2021-06-24 23:55:07 : epoch 60d51b5b : nsds01 : ganesha.nfsd-116575[main] nfs_Start_threads :THREAD :EVENT :General fridge was started successfully
2021-06-24 23:55:07 : epoch 60d51b5b : nsds01 : ganesha.nfsd-116575[main] nfs_start :NFS STARTUP :EVENT :-------------------------------------------------
2021-06-24 23:55:07 : epoch 60d51b5b : nsds01 : ganesha.nfsd-116575[main] nfs_start :NFS STARTUP :EVENT :             NFS SERVER INITIALIZED
2021-06-24 23:55:07 : epoch 60d51b5b : nsds01 : ganesha.nfsd-116575[main] nfs_start :NFS STARTUP :EVENT :-------------------------------------------------
2021-06-24 23:55:09 : epoch 60d51b5b : nsds01 : ganesha.nfsd-116575[dbus] nfs_start_grace :STATE :EVENT :NFS Server Now IN GRACE, duration 90
2021-06-24 23:55:09 : epoch 60d51b5b : nsds01 : ganesha.nfsd-116575[dbus] nfs_start_grace :STATE :EVENT :NFS Server recovery event 5 nodeid -1 ip 10.11.4.33
2021-06-24 23:55:09 : epoch 60d51b5b : nsds01 : ganesha.nfsd-116575[dbus] fs_read_recov_clids_takeover :CLIENT ID :EVENT :Recovery for nodeid -1 dir (/var/lib/nfs/ganesha/10.11.4.33/v4recov)
2021-06-24 23:55:09 : epoch 60d51b5b : nsds01 : ganesha.nfsd-116575[dbus] fs_read_recov_clids_impl :CLIENT ID :EVENT :Failed to open v4 recovery dir (/var/lib/nfs/ganesha/10.11.4.33/v4recov), errno: No such file or directory (2)
2021-06-24 23:55:09 : epoch 60d51b5b : nsds01 : ganesha.nfsd-116575[dbus] fs_read_recov_clids_takeover :CLIENT ID :EVENT :Failed to read v4 recovery dir (/var/lib/nfs/ganesha/10.11.4.33/v4recov)
2021-06-24 23:55:09 : epoch 60d51b5b : nsds01 : ganesha.nfsd-116575[dbus] nfs_start_grace :STATE :EVENT :NFS Server Now IN GRACE, duration 90
2021-06-24 23:55:09 : epoch 60d51b5b : nsds01 : ganesha.nfsd-116575[dbus] nfs_start_grace :STATE :EVENT :NFS Server recovery event 5 nodeid -1 ip 10.11.4.32
2021-06-24 23:55:09 : epoch 60d51b5b : nsds01 : ganesha.nfsd-116575[dbus] fs_read_recov_clids_takeover :CLIENT ID :EVENT :Recovery for nodeid -1 dir (/var/lib/nfs/ganesha/10.11.4.32/v4recov)
2021-06-24 23:55:09 : epoch 60d51b5b : nsds01 : ganesha.nfsd-116575[dbus] fs_read_recov_clids_impl :CLIENT ID :EVENT :Failed to open v4 recovery dir (/var/lib/nfs/ganesha/10.11.4.32/v4recov), errno: No such file or directory (2)
2021-06-24 23:55:09 : epoch 60d51b5b : nsds01 : ganesha.nfsd-116575[dbus] fs_read_recov_clids_takeover :CLIENT ID :EVENT :Failed to read v4 recovery dir (/var/lib/nfs/ganesha/10.11.4.32/v4recov)
2021-06-24 23:55:10 : epoch 60d51b5b : nsds01 : ganesha.nfsd-116575[dbus] nfs_start_grace :STATE :EVENT :NFS Server Now IN GRACE, duration 90
2021-06-24 23:55:10 : epoch 60d51b5b : nsds01 : ganesha.nfsd-116575[dbus] nfs_start_grace :STATE :EVENT :NFS Server recovery event 2 nodeid -1 ip 10.11.4.33
2021-06-24 23:55:10 : epoch 60d51b5b : nsds01 : ganesha.nfsd-116575[dbus] nfs_release_v4_clients :STATE :EVENT :NFS Server V4 recovery release ip 10.11.4.33
2021-06-24 23:56:47 : epoch 60d51b5b : nsds01 : ganesha.nfsd-116575[reaper] nfs_lift_grace_locked :STATE :EVENT :NFS Server Now NOT IN GRACE

2021-06-25 00:18:01 : epoch 60d51b5b : nsds01 : ganesha.nfsd-116575[svc_45] fsal_common_is_referral :FSAL :EVENT :Failed to get attrs for referral, handle: 0x7f370400b660, valid_mask: 0, request_mask: 11dfce, supported: 0, error: Permission denied
2021-06-25 00:18:01 : epoch 60d51b5b : nsds01 : ganesha.nfsd-116575[svc_23] fsal_common_is_referral :FSAL :EVENT :Failed to get attrs for referral, handle: 0x7f370400b660, valid_mask: 0, request_mask: 11dfce, supported: 0, error: Permission denied

Please advice, thanks. 

Many thanks
Bom

**Comment by ffilz** [comment]
@bom-bahadur this really is a new issue, could you please open a new issue.

**Comment by bom-bahadur** [comment]
@ffilz Sure, thanks.
https://github.com/nfs-ganesha/nfs-ganesha/issues/722

**Comment by turtle-bazon** [comment]
I have same issue with privileged container on Debian 11. nfs-kernel-server in that container works

**Comment by ffilz** [comment]
> I have same issue with privileged container on Debian 11. nfs-kernel-server in that container works

Which issue? 

This issue has been closed and has too many different things going on in it. Please open a new issue or look at the open issues to see if there's a relevant issue already open.

**Comment by Davidrjx** [comment]
in kubernetes pod container, similar error as the following
```
...
24/12/2021 03:03:35 : epoch 61c53887 : <pod name> : ganesha.nfsd-6[main] nfs_start :NFS STARTUP :EVENT :-------------------------------------------------
24/12/2021 03:03:35 : epoch 61c53887 : <pod name>: ganesha.nfsd-6[main] nfs_start :NFS STARTUP :EVENT :             NFS SERVER INITIALIZED
24/12/2021 03:03:35 : epoch 61c53887 : <pod name> : ganesha.nfsd-6[main] nfs_start :NFS STARTUP :EVENT :-------------------------------------------------
24/12/2021 03:05:05 : epoch 61c53887 : <pod name> : ganesha.nfsd-6[reaper] nfs_lift_grace_locked :STATE :EVENT :NFS Server Now NOT IN GRACE
13/04/2022 14:48:55 : epoch 61c53887 : <pod name> : ganesha.nfsd-6[svc_73788] fsal_common_is_referral :FSAL :EVENT :Failed to get attrs for referral, handle: 0x7f68ec254490, valid_mask: 0, request_mask: 10c086, supported: 0, error: The file no longer exists
01/11/2022 08:46:22 : epoch 61c53887 : <pod name> : ganesha.nfsd-6[svc_605491] fsal_common_is_referral :FSAL :EVENT :Failed to get attrs for referral, handle: 0x7f68d8a666a0, valid_mask: 0, request_mask: 10c086, supported: 0, error: The file no longer exists
09/11/2022 12:32:47 : epoch 61c53887 : <pod name>: ganesha.nfsd-6[svc_629812] fsal_common_is_referral :FSAL :EVENT :Failed to get attrs for referral, handle: 0x7f69200d07a0, valid_mask: 0, request_mask: 10c086, supported: 0, error: The file no longer exists
18/11/2022 02:29:59 : epoch 61c53887 : <pod name> : ganesha.nfsd-6[svc_656758] fsal_common_is_referral :FSAL :EVENT :Failed to get attrs for referral, handle: 0x7f692025a730, valid_mask: 0, request_mask: 10c086, supported: 0, error: The file no longer exists
19/11/2022 07:40:21 : epoch 61c53887 : <pod name> : ganesha.nfsd-6[svc_659653] fsal_common_is_referral :FSAL :EVENT :Failed to get attrs for referral, handle: 0x7f692406c9d0, valid_mask: 0, request_mask: 10c086, supported: 0, error: The file no longer exists
23/11/2022 05:45:31 : epoch 61c53887 : <pod name> : ganesha.nfsd-6[svc_669812] fsal_common_is_referral :FSAL :EVENT :Failed to get attrs for referral, handle: 0x7f691c37b160, valid_mask: 0, request_mask: 10c086, supported: 0, error: The file no longer exists
24/11/2022 12:05:22 : epoch 61c53887 : <pod name> : ganesha.nfsd-6[svc_674227] fsal_common_is_referral :FSAL :EVENT :Failed to get attrs for referral, handle: 0x7f6920a08b10, valid_mask: 0, request_mask: 10c086, supported: 0, error: The file no longer exists
...
```

**Comment by Davidrjx** [comment]
> in kubernetes pod container, similar error as the following
> 
> ```
> ...
> 24/12/2021 03:03:35 : epoch 61c53887 : <pod name> : ganesha.nfsd-6[main] nfs_start :NFS STARTUP :EVENT :-------------------------------------------------
> 24/12/2021 03:03:35 : epoch 61c53887 : <pod name>: ganesha.nfsd-6[main] nfs_start :NFS STARTUP :EVENT :             NFS SERVER INITIALIZED
> 24/12/2021 03:03:35 : epoch 61c53887 : <pod name> : ganesha.nfsd-6[main] nfs_start :NFS STARTUP :EVENT :-------------------------------------------------
> 24/12/2021 03:05:05 : epoch 61c53887 : <pod name> : ganesha.nfsd-6[reaper] nfs_lift_grace_locked :STATE :EVENT :NFS Server Now NOT IN GRACE
> 13/04/2022 14:48:55 : epoch 61c53887 : <pod name> : ganesha.nfsd-6[svc_73788] fsal_common_is_referral :FSAL :EVENT :Failed to get attrs for referral, handle: 0x7f68ec254490, valid_mask: 0, request_mask: 10c086, supported: 0, error: The file no longer exists
> 01/11/2022 08:46:22 : epoch 61c53887 : <pod name> : ganesha.nfsd-6[svc_605491] fsal_common_is_referral :FSAL :EVENT :Failed to get attrs for referral, handle: 0x7f68d8a666a0, valid_mask: 0, request_mask: 10c086, supported: 0, error: The file no longer exists
> 09/11/2022 12:32:47 : epoch 61c53887 : <pod name>: ganesha.nfsd-6[svc_629812] fsal_common_is_referral :FSAL :EVENT :Failed to get attrs for referral, handle: 0x7f69200d07a0, valid_mask: 0, request_mask: 10c086, supported: 0, error: The file no longer exists
> 18/11/2022 02:29:59 : epoch 61c53887 : <pod name> : ganesha.nfsd-6[svc_656758] fsal_common_is_referral :FSAL :EVENT :Failed to get attrs for referral, handle: 0x7f692025a730, valid_mask: 0, request_mask: 10c086, supported: 0, error: The file no longer exists
> 19/11/2022 07:40:21 : epoch 61c53887 : <pod name> : ganesha.nfsd-6[svc_659653] fsal_common_is_referral :FSAL :EVENT :Failed to get attrs for referral, handle: 0x7f692406c9d0, valid_mask: 0, request_mask: 10c086, supported: 0, error: The file no longer exists
> 23/11/2022 05:45:31 : epoch 61c53887 : <pod name> : ganesha.nfsd-6[svc_669812] fsal_common_is_referral :FSAL :EVENT :Failed to get attrs for referral, handle: 0x7f691c37b160, valid_mask: 0, request_mask: 10c086, supported: 0, error: The file no longer exists
> 24/11/2022 12:05:22 : epoch 61c53887 : <pod name> : ganesha.nfsd-6[svc_674227] fsal_common_is_referral :FSAL :EVENT :Failed to get attrs for referral, handle: 0x7f6920a08b10, valid_mask: 0, request_mask: 10c086, supported: 0, error: The file no longer exists
> ...
> ```

tcp traffic shows the error,
```
14:09:13.910335 IP 192.168.46.1.1014 > 192.168.80.106.nfs: Flags [.], ack 2137, win 652, options [nop,nop,TS val 590888896 ecr 3447282627], length 0
14:09:13.910355 IP 192.168.46.1.1014 > 192.168.80.106.nfs: Flags [.], ack 2137, win 652, options [nop,nop,TS val 590888896 ecr 3447282627], length 0
14:09:29.013182 IP 192.168.46.1.1014 > 192.168.80.106.nfs: Flags [P.], seq 3480:3676, ack 2137, win 652, options [nop,nop,TS val 590892672 ecr 3447282627], length 196: NFS request xid 1139445935 192 getattr fh 0,2/53
14:09:29.013245 IP 192.168.46.1.1014 > 192.168.80.106.nfs: Flags [P.], seq 3480:3676, ack 2137, win 652, options [nop,nop,TS val 590892672 ecr 3447282627], length 196: NFS request xid 1139445935 192 getattr fh 0,2/53
14:09:29.014388 IP 192.168.80.106.nfs > 192.168.46.1.1014: Flags [P.], seq 2137:2237, ack 3676, win 502, options [nop,nop,TS val 3447297731 ecr 590892672], length 100: NFS reply xid 1139445935 reply ok 96 getattr ERROR: Request couldn't be completed in time
14:09:29.014423 IP 192.168.80.106.nfs > 192.168.46.1.1014: Flags [P.], seq 2137:2237, ack 3676, win 502, options [nop,nop,TS val 3447297731 ecr 590892672], length 100: NFS reply xid 1139445935 reply ok 96 getattr ERROR: Request couldn't be completed in time
14:09:29.014516 IP 192.168.46.1.1014 > 192.168.80.106.nfs: Flags [.], ack 2237, win 652, options [nop,nop,TS val 590892672 ecr 3447297731], length 0
14:09:29.014561 IP 192.168.46.1.1014 > 192.168.80.106.nfs: Flags [.], ack 2237, win 652, options [nop,nop,TS val 590892672 ecr 3447297731], length 0

```

**Comment by ffilz** [comment]
Again, PLEASE open a new issue with a description of the problem currently at issue, the version of Ganesha being used, and any supporting documentation. Adding new instances of an issue in a closed issue report, especially one that appears to have multiple issues and is confusing is not helpful.

**Comment by psy0rz** [comment]
i also have a random issue with a random thing :P
